category,datetime,headline,id,image,related,source,summary,url
company,1777061700,"Month-End Portfolio Data Now Available for Ares Dynamic Credit Allocation Fund, Inc.",139881911,https://s.yimg.com/rz/stage/p/yahoo_finance_en-US_h_p_finance_2.png,ARES,Yahoo,"NEW YORK, NY / ACCESS Newswire / April 24, 2026 / Ares Capital Management II LLC today announced that monthly fund composition and performance data for Ares Dynamic Credit Allocation Fund, Inc. (NYSE:ARDC) as of March 31, 2026, is now available via ...",https://finnhub.io/api/news?id=a378f30a583cae14f33d68734d4f8760495eb87cb72dddc6047aebd7a2e31459
company,1777049472,Amazon-Backed X-Energy Climbs 31% After $1.02 Billion US IPO,139879784,https://s.yimg.com/rz/stage/p/yahoo_finance_en-US_h_p_finance_2.png,ARES,Yahoo,"(Bloomberg) -- X-Energy Inc. shares opened 31% above their IPO price, after the nuclear energy firm raised $1.02 billion in an upsized US initial public offering.Most Read from BloombergUS Reduces Marijuana Restrictions in Lift to Ailing IndustryMeta Tells Staff It Will Cut 10% of Jobs in Push for EfficiencyAnthropic’s Mythos Model Is Being Accessed by Unauthorized UsersInside Alex Cooper’s Unwell: Tears, Screaming and Employees Looking for the ExitTrump’s Messaging Blitz Divides Advisers as Ira",https://finnhub.io/api/news?id=d97bc7cab6bc62604f5fbe4f66f1f8ffe06049623a5d65108373d75051dfc4bf
company,1777043151,"Market Chatter: Amazon, Ares Set for Big Windfall From X-Energy IPO",139877486,https://s.yimg.com/rz/stage/p/yahoo_finance_en-US_h_p_finance_2.png,ARES,Yahoo,"Ares Management (ARES), Amazon (AMZN) and Ken Griffin are set to score large gains from X-Energy's (",https://finnhub.io/api/news?id=9570d624fd8a7ff824285e6480c9f40424d2af8ca715446c42f89f8e4324e3dc
company,1777039208,Ares Management (ARES) Reports Next Week: Wall Street Expects Earnings Growth,139878057,https://s.yimg.com/rz/stage/p/yahoo_finance_en-US_h_p_finance_2.png,ARES,Yahoo,Ares Management (ARES) doesn't possess the right combination of the two key ingredients for a likely earnings beat in its upcoming report. Get prepared with the key expectations.,https://finnhub.io/api/news?id=c1651ef4ac8947c86d6593394e51214dacd1027155142daf153411cb1251ebaf
company,1777035034,Nuclear reactor company X-energy shares surge 34% as AI drives interest in the industry its IPO,139878562,https://image.cnbcfm.com/api/v1/image/108297006-1777049308617-gettyimages-2272243875-X-ENERGY_IPO.jpeg?v=1777049392&w=1920&h=1080,ARES,CNBC,Advanced nuclear reactor company X-energy began trading Friday as the AI boom and electrification broadly spark a flurry of interest in the nuclear industry.,https://finnhub.io/api/news?id=b3eb7ffb118ce9ab7f670ab1722944711a8d2bb7d909874803636e9098f37015
company,1777012200,Insurers Are Lending to the Same Private-Credit Funds That Investors Are Rushing to Exit,139874319,https://s.yimg.com/rz/stage/p/yahoo_finance_en-US_h_p_finance_2.png,ARES,Yahoo,"Athene, Mass Mutual, and other insurers hold nearly $16 billion in bonds from private-credit funds facing heavy redemption requests.",https://finnhub.io/api/news?id=614e1a3f0c1e74636fce24c03102d23465cf9eb968cbc99509376e08d9c37fb3
company,1777012200,It’s Crunchtime for Private Credit as the Leading Funds Get Ready to Report Earnings,139874343,https://s.yimg.com/rz/stage/p/yahoo_finance_en-US_h_p_finance_2.png,ARES,Yahoo,"Money has flowed out of the leading credit funds, and investors will be looking for indications the flood is slowing",https://finnhub.io/api/news?id=c8f9c51e6a837a257be14483679236a003d610002c17f2d3c6469f2a896e327f
company,1776989515,Amazon-Backed Nuclear Firm X-Energy Raises $1.02 Billion in IPO,139871289,https://s.yimg.com/rz/stage/p/yahoo_finance_en-US_h_p_finance_2.png,ARES,Yahoo,"(Bloomberg) -- X-Energy Inc., a nuclear energy firm that counts Amazon.com Inc. as a backer, raised $1.02 billion in an upsized US initial public offering that priced above the marketed range.Most Read from BloombergAnthropic’s Mythos Model Is Being Accessed by Unauthorized UsersInside Alex Cooper’s Unwell: Tears, Screaming and Employees Looking for the ExitMeta Tells Staff It Will Cut 10% of Jobs in Push for EfficiencyMicrosoft Offers Buyouts to About 7% of US WorkersTrump Encourages Companies",https://finnhub.io/api/news?id=1def2f891c681423d4f6923a93989dc329684b71c5708125843d17280b440d5a
