category,datetime,headline,id,image,related,source,summary,url
company,1777055700,Will Declining Memberships Weigh on Centene's Q1 Earnings?,139881875,https://s.yimg.com/rz/stage/p/yahoo_finance_en-US_h_p_finance_2.png,CI,Yahoo,"CNC gears up for Q1 results with earnings seen plunging 36% despite modest revenue growth, as rising medical costs and shrinking memberships weigh.",https://finnhub.io/api/news?id=765fbe2a6c739f8b1b64aa96fdc61c25ab51bec30cb3770f4cfcca5f3cfde354
company,1777052655,"Health Care Down on Earnings, Regulatory Fears -- Health Care Roundup",139881539,,CI,Finnhub,"Health-care companies fell amid concerns about regulation in the sector. U.S. health insurers are accelerating efforts to streamline prior authorization requirements, with UnitedHealthcare, Aetna...",https://finnhub.io/api/news?id=58291d74146de31034ef93d959be0a555b14de74f9b4a8548587d597827a73e5
company,1777038328,Jefferies Adjusts The Cigna Group (CI) Target Lower After Health Insurance Exchange Review,139876497,https://s.yimg.com/rz/stage/p/yahoo_finance_en-US_h_p_finance_2.png,CI,Yahoo,We recently compiled a list of the 9 Most Undervalued Healthcare Stocks to Buy Now. The Cigna Group is one of the most undervalued stocks to invest in. TheFly reported on April 20 that Jefferies reaffirmed its Buy recommendation on CI while slightly reducing its price objective from $333 to $330 after revising its outlook […],https://finnhub.io/api/news?id=198499a1f79b5b49b4beaa1784b4e2248342d019839db0963c49646d4c6f1756
company,1777035840,"The Cigna Group, Leading Health Plans Advance Work to Simplify Prior Authorization",139876498,https://s.yimg.com/rz/stage/p/yahoo_finance_en-US_h_p_finance_2.png,CI,Yahoo,"The Cigna Group (NYSE:CI), a global health company, today joined leading health plans in a commitment to standardize electronic prior authorization submission requirements for commonly reviewed medical services, a step that will accelerate patients' access to care and simplify administrative work for providers and their teams.",https://finnhub.io/api/news?id=416a91f3671fb160df46efc92a1d846126e2522efa8266f4deef79de873818d7
company,1777024222,U.S. Health Insurers Step Up Prior Authorization Reforms Amid Industry Pressure -- Update,139876198,,CI,Finnhub,"By Connor Hart U.S. health insurers are accelerating efforts to streamline prior authorization requirements, with UnitedHealthcare, Aetna and Cigna on Friday detailing progress toward industry...",https://finnhub.io/api/news?id=e8a87d94a6b2a16a1afe526af307bd5f83ad8485e0a2144cdfb3699eb057ff83
