category,datetime,headline,id,image,related,source,summary,url
company,1777056967,Cramer looks ahead to next week's big tech earnings,139888347,https://image.cnbcfm.com/api/v1/image/108297234-6ED3-MM-A-BLOCK-042426.jpg?v=1777070551&w=1920&h=1080,CMG,CNBC,'Mad Money' host Jim Cramer looks ahead to next week's market moving moments.,https://finnhub.io/api/news?id=b1cfed3ba8249597ee87e1aaf0d63aa41ba7634398bd0cae24f1bcaa25fed8e9
company,1777055420,$100 Invested In Chipotle Mexican Grill 20 Years Ago Would Be Worth This Much Today,139889267,,CMG,Benzinga, ,https://finnhub.io/api/news?id=ab856198336423d4cb3adf48601676c147ae600ddd6ed41245218b94ade8cf78
company,1777047005,"Restaurant Stocks Trail Market Amid Soft Demand, Early Q2 Volatility, BofA Says",139879445,https://s.yimg.com/rz/stage/p/yahoo_finance_en-US_h_p_finance_2.png,CMG,Yahoo,"Restaurant stocks are trailing the broader market as Q2 gets underway, with rising gasoline prices a",https://finnhub.io/api/news?id=781cf11971f242992d8ffa1219413e3a314c2489e1d802933da6b2754bd951c6
company,1777043520,Starbucks to Post Q2 Earnings: What's in the Cards for the Stock?,139879559,https://s.yimg.com/rz/stage/p/yahoo_finance_en-US_h_p_finance_2.png,CMG,Yahoo,"SBUX's Q2 FY26 results may show ""Back to Starbucks"" progress and menu innovation, partly offset by seasonal margin pressures and cost headwinds.",https://finnhub.io/api/news?id=f05bb3e7805e403ce472e0dd2ceec454949dd315e5fb7f798ddeeb1650acfc85
company,1777040760,Chipotle Gears Up for Q1 Earnings: Buy Now or Wait It Out?,139877833,https://s.yimg.com/rz/stage/p/yahoo_finance_en-US_h_p_finance_2.png,CMG,Yahoo,CMG heads into Q1 earnings with solid sales drivers but rising costs and valuation concerns cloud upside potential ahead of its April 29 report.,https://finnhub.io/api/news?id=b372fcb7450c8225588437edd074a9d47f06dfabc605cca994980ee46b52b845
company,1777038244,"Intel upgraded, DraftKings downgraded: Wall Street's top analyst calls",139876328,https://s.yimg.com/rz/stage/p/yahoo_finance_en-US_h_p_finance_2.png,CMG,Yahoo,"Intel upgraded, DraftKings downgraded: Wall Street's top analyst calls",https://finnhub.io/api/news?id=caef7dc83c266995df63e0cbcd5e0c26d9de9810fc26439ac207f580fffed3ac
company,1777036507,What Analyst Projections for Key Metrics Reveal About Chipotle (CMG) Q1 Earnings,139877834,https://s.yimg.com/rz/stage/p/yahoo_finance_en-US_h_p_finance_2.png,CMG,Yahoo,"Evaluate the expected performance of Chipotle (CMG) for the quarter ended March 2026, looking beyond the conventional Wall Street top-and-bottom-line estimates and examining some of its key metrics for better insight.",https://finnhub.io/api/news?id=a539b803667709ea953405932f07a362805eb30c5e25cd60ab90b753b02a7f03
company,1777018980,"The Zacks Analyst Blog The Cheesecake Factory, Chipotle, CAVA and Shake Shack",139875330,https://s.yimg.com/rz/stage/p/yahoo_finance_en-US_h_p_finance_2.png,CMG,Yahoo,"CAVA stands out among restaurant stocks poised for earnings surprises as demand, pricing, and expansion drive growth despite lingering margin pressures.",https://finnhub.io/api/news?id=66eb4b7b3a3d0db23f00539511b1a24371c89b0b4d84d05714a62a0edc84bf8b
company,1777015500,"Since a Surprise Leadership Change in 2024, This Growth Stock Is Down 37%. Investors Shouldn't Blame the CEO.",139873289,https://s.yimg.com/rz/stage/p/yahoo_finance_en-US_h_p_finance_2.png,CMG,Yahoo,Falling same-store sales and a declining share price don't support the market's confidence.,https://finnhub.io/api/news?id=e56220e0b22b2465406fdbd63826d3cabad0d2069e097abbdfce9756267268e7
