category,datetime,headline,id,image,related,source,summary,url
company,1777053360,QXO Continues to Tumble Following TopBuild Deal,139880934,https://s.yimg.com/rz/stage/p/yahoo_finance_en-US_h_p_finance_2.png,HD,Yahoo,"Shares of QXO have tumbled nearly 15% this week, following news that the company planned to buy insulation distributor and installer TopBuild for $17 billion.",https://finnhub.io/api/news?id=a1ae683198835b4675e50916ea67eacfb051380dd353c3fdf364a4a1a058f85e
company,1777056740,"Truist is Bullish on Amazon.com, Inc. (AMZN)",139880499,https://s.yimg.com/rz/stage/p/yahoo_finance_en-US_h_p_finance_2.png,HD,Yahoo,"Amazon.com, Inc. (NASDAQ:AMZN) is one of the 10 Best Performing Dow Stocks So Far in 2026. On April 17, 2026, Truist lifted its target price for Amazon.com, Inc. (NASDAQ:AMZN) to $285 from $280. The analysts kept their Buy rating before Q1 earnings. Truist expects its AWS business to grow faster than the expansion in e-commerce […]",https://finnhub.io/api/news?id=f3fc8f2e00ed2ba4b4e0c7afe9b7b3ce8b0013762399acfbaa334a03e45dd261
company,1777044959,Lowe’s Companies Inc. (LOW): One of the Best Defensive Stocks to Buy Now,139877608,https://s.yimg.com/rz/stage/p/yahoo_finance_en-US_h_p_finance_2.png,HD,Yahoo,"We just covered the 14 Best Defensive Stocks to Invest In Now and Lowe’s Companies, Inc. (NYSE:LOW) ranks 3rd on this list. Lowe’s Companies, Inc. (NYSE:LOW) is viewed as a top defensive stock, particularly in the housing-adjacent retail space. While it shares many similarities with Home Depot, Lowe’s is often considered more defensive due to […]",https://finnhub.io/api/news?id=c101fa05b3529296dc47ae3a48b87a1a35db3f2a949ee4bf0c01e6a50cd87f1b
company,1777044900,"Could Home Depot Quietly Turn a $25,000 Investment Into a Millionaire Retirement?",139877436,https://s.yimg.com/rz/stage/p/yahoo_finance_en-US_h_p_finance_2.png,HD,Yahoo,"In the past 30 years, this top retail stock would've turned a $17,000 starting sum into $1 million today.",https://finnhub.io/api/news?id=f8a221bffafa8077e1c0ca05f73d5001e082ae9d203cdfa724fdd15cb297353b
company,1777044857,The Home Depot Inc. (HD): Core Defensive Holding Due to Massive Scale,139877610,https://s.yimg.com/rz/stage/p/yahoo_finance_en-US_h_p_finance_2.png,HD,Yahoo,"We just covered the 14 Best Defensive Stocks to Invest In Now and The Home Depot, Inc. (NYSE:HD) ranks 1st on this list. The Home Depot, Inc. (NYSE:HD) is considered a core defensive stock due to its massive scale, irreplaceable physical footprint, and its essential role in maintaining the aging US housing market. While the […]",https://finnhub.io/api/news?id=056f608ec014c582160b03c194968abc49a5999ffdf3b66c38fe2dc8c94b315b
company,1777028832,Home Depot (HD) Valuation Check As Analyst Upside Clashes With Cautious Cash Flow Signals,139875202,https://s.yimg.com/rz/stage/p/yahoo_finance_en-US_h_p_finance_2.png,HD,Yahoo,"Setting the scene for Home Depot stock Home Depot (HD) has been drawing fresh attention as investors reassess the home improvement retailer’s recent share performance, income profile, and multichannel business in relation to its current market valuation. See our latest analysis for Home Depot. At a latest share price of $340.16, Home Depot has seen modest short term share price gains over the past month, alongside a weaker 90 day share price return and a mixed total shareholder return picture...",https://finnhub.io/api/news?id=a6f0612448b02bcad93eb400e07e98547a59850caaf01e9390a0db8baf3f85a5
company,1777025700,"I’m 56. My home has $400,000 in equity. If I lose my job, should I do a reverse mortgage?",139876343,https://s.yimg.com/rz/stage/p/yahoo_finance_en-US_h_p_finance_2.png,HD,Yahoo,"“I currently make $145,000, and my wife makes $98,000.”",https://finnhub.io/api/news?id=fd78228dcbb7f1d0a943787c67cdaf7dd865504b895081395cd7612753941716
company,1776990563,1 Profitable Stock with Exciting Potential and 2 We Avoid,139871312,https://s.yimg.com/rz/stage/p/yahoo_finance_en-US_h_p_finance_2.png,HD,Yahoo,Not all profitable companies are built to last - some rely on outdated models or unsustainable advantages. Just because a business is in the green today doesn’t mean it will thrive tomorrow.,https://finnhub.io/api/news?id=444e64c9bf6cadd577f495cd9342f37e274da5d0b76b58ae765a80ec8a7b58b9
