category,datetime,headline,id,image,related,source,summary,url
company,1777062375,Best Dividend Kings: April 2026,139882939,https://static.seekingalpha.com/cdn/s3/uploads/getty_images/2232970921/image_2232970921.jpg?io=getty-c-w1536,ITW,SeekingAlpha,"Dividend Kings beat SPY YTD. See which are undervalued with 10%+ expected returns using Dividend Yield Theory, plus dividend growth trendsâread now.",https://finnhub.io/api/news?id=17d072be3c2e3c14c0de6cc049ae37e3aad6d33565f5290f096d5c0dab42bc91
company,1777058820,Allegion Gears Up to Post Q1 Earnings: Is a Beat in the Offing?,139881878,https://s.yimg.com/rz/stage/p/yahoo_finance_en-US_h_p_finance_2.png,ITW,Yahoo,"ALLE eyes Q1 growth on strong Americas demand and acquisitions, but rising costs and forex headwinds could temper earnings momentum.",https://finnhub.io/api/news?id=870493aa0938db9f2bb35f0522b09b37b3af467e9a08022bb0007220d5f6c5be
company,1777058520,IDEX Gears Up to Report Q1 Earnings: What's in the Cards?,139881879,https://s.yimg.com/rz/stage/p/yahoo_finance_en-US_h_p_finance_2.png,ITW,Yahoo,"IEX heads into Q1 with modest growth expected from health and water segments, but weak fire safety demand and rising costs may weigh on results.",https://finnhub.io/api/news?id=f04fef652aa315308155326aa2032e312cf96a4171e499d1c2d537c72b807133
company,1777045059,Illinois Tool Works Inc. (ITW): Emerging as Premier Defensive Play,139877794,https://s.yimg.com/rz/stage/p/yahoo_finance_en-US_h_p_finance_2.png,ITW,Yahoo,We just covered the 14 Best Defensive Stocks to Invest In Now and Illinois Tool Works Inc. (NYSE:ITW) ranks 6th on this list. The primary defensive moat for Illinois Tool Works Inc. (NYSE:ITW) is its proprietary 80/20 Front-to-Back Process. The company focuses its resources on the 20% of its customers and products that generate 80% […],https://finnhub.io/api/news?id=1fbd34fcbb93e0244d3ba687de5f321b7a92fb3e8fc4f05e4f1f6dffe4ab64b1
company,1777040400,Avery Dennison to Report Q1 Earnings: What's in Store for the Stock?,139877911,https://s.yimg.com/rz/stage/p/yahoo_finance_en-US_h_p_finance_2.png,ITW,Yahoo,"AVY heads into Q1 earnings release with rising revenue and EPS estimates, but margin pressures and a negative Earnings ESP cloud its near-term outlook.",https://finnhub.io/api/news?id=712be57c930001119ce22d58f08a4746efe2f3dde1e99d5c809bea9bdb041635
company,1777039209,Analysts Estimate Gates Industrial (GTES) to Report a Decline in Earnings: What to Look Out for,139879606,https://s.yimg.com/rz/stage/p/yahoo_finance_en-US_h_p_finance_2.png,ITW,Yahoo,Gates Industrial (GTES) doesn't possess the right combination of the two key ingredients for a likely earnings beat in its upcoming report. Get prepared with the key expectations.,https://finnhub.io/api/news?id=a346ab1add759d60e6881dbd3ffc689697821fd7e9227395c341b3b9deb57956
