category,datetime,headline,id,image,related,source,summary,url
company,1777062375,Best Dividend Kings: April 2026,139882939,https://static.seekingalpha.com/cdn/s3/uploads/getty_images/2232970921/image_2232970921.jpg?io=getty-c-w1536,KO,SeekingAlpha,"Dividend Kings beat SPY YTD. See which are undervalued with 10%+ expected returns using Dividend Yield Theory, plus dividend growth trendsâread now.",https://finnhub.io/api/news?id=17d072be3c2e3c14c0de6cc049ae37e3aad6d33565f5290f096d5c0dab42bc91
company,1777057642,"Coca-Cola Poised for In-Line Quarterly Print Despite Global Macro Volatility, RBC Says",139880620,https://s.yimg.com/rz/stage/p/yahoo_finance_en-US_h_p_finance_2.png,KO,Yahoo,"Coca-Cola's (KO) first-quarter results are likely to meet Wall Street's expectations, showing ""resil",https://finnhub.io/api/news?id=d80c159f7ddcec6d4fdbccee9e2bae78364aa71c712b6724d04301ea144cc6ac
company,1777056967,Cramer looks ahead to next week's big tech earnings,139888347,https://image.cnbcfm.com/api/v1/image/108297234-6ED3-MM-A-BLOCK-042426.jpg?v=1777070551&w=1920&h=1080,KO,CNBC,'Mad Money' host Jim Cramer looks ahead to next week's market moving moments.,https://finnhub.io/api/news?id=b1cfed3ba8249597ee87e1aaf0d63aa41ba7634398bd0cae24f1bcaa25fed8e9
company,1777056732,Coca-Cola (KO) Plans to Invest in South Africa by 2030,139880621,https://s.yimg.com/rz/stage/p/yahoo_finance_en-US_h_p_finance_2.png,KO,Yahoo,"The Coca-Cola Company (NYSE:KO) is one of the 10 Best Performing Dow Stocks So Far in 2026. On April 1, 2026, Reuters reported that The Coca-Cola Company (NYSE:KO) and its approved bottlers want to invest 17.6 billion rand ($1.05 billion) in South Africa by 2030. It referenced comments made by Africa operating unit president Luis […]",https://finnhub.io/api/news?id=6b86ce9053de97df0c836115632f7227a1377385fa3c61143ed2f91e362f45c3
company,1777050966,"The Week Ahead: April 24, 2026",139888368,https://image.cnbcfm.com/api/v1/image/108297092-S-WEEK-THAT-WAS-CC-042426.jpg?v=1777055604&w=1920&h=1080,KO,CNBC,CNBC's Dom Chu looks ahead to what are likely to be next week's top business and financial stories.,https://finnhub.io/api/news?id=d62078bcd522b9247d385be0c0011a11ada380c13357cc6b95e29da075fecc5c
company,1777049654,Keurig Dr Pepper: Good Dividend And Excellent Growth Prospects At A Bargain Price,139881234,https://static.seekingalpha.com/cdn/s3/uploads/getty_images/459232825/image_459232825.jpg?io=getty-c-w1536,KO,SeekingAlpha,Keurig Dr Pepper is about to spin off both its beverage and coffee entities. Read how this move could unlock opportunities for investors.,https://finnhub.io/api/news?id=f91da68f41a463807ba014bf7b76065b7b05ab01123eab1ff6673981ed553af6
company,1777044420,3 Consumer Staples Stocks That Provide Stability in a Volatile Investing Environment,139877438,https://s.yimg.com/rz/stage/p/yahoo_finance_en-US_h_p_finance_2.png,KO,Yahoo,You want companies that deliver in good times and bad? You've come to the right place.,https://finnhub.io/api/news?id=254486b5d4a6976ef2b0e621abcc220f67405e0790b00776e9a24813eed09bde
company,1777041630,The Coca-Cola Company (KO): Investors Hedge Against Economic Volatility,139877657,https://s.yimg.com/rz/stage/p/yahoo_finance_en-US_h_p_finance_2.png,KO,Yahoo,"We just covered the 15 Safe Stocks to Invest In For Beginners and The Coca-Cola Company (NYSE:KO) ranks 9th on this list. While high-growth tech often grabs headlines, the smart money is positioning itself into The Coca-Cola Company (NYSE:KO) as a hedge against the geopolitical and economic volatility characterizing the first half of 2026. Historically, […]",https://finnhub.io/api/news?id=92fc4d58bb2c848f17c0582819272fa78bf6c0dd38a46086c95f8183b58a5c09
company,1777014571,COCA-COLA CO : RBC gives a Buy rating,139874826,,KO,Finnhub,"In a research note published by Nik Modi, RBC advises its customers to buy the stock. The target price remains unchanged at USD 87.",https://finnhub.io/api/news?id=0d63428c2bd2ef3f51f5421cb3e2c8a69e30c17c23895a84b13f3fb8cedea0ac
