category,datetime,headline,id,image,related,source,summary,url
company,1777062375,Best Dividend Kings: April 2026,139882939,https://static.seekingalpha.com/cdn/s3/uploads/getty_images/2232970921/image_2232970921.jpg?io=getty-c-w1536,LOW,SeekingAlpha,"Dividend Kings beat SPY YTD. See which are undervalued with 10%+ expected returns using Dividend Yield Theory, plus dividend growth trendsâread now.",https://finnhub.io/api/news?id=17d072be3c2e3c14c0de6cc049ae37e3aad6d33565f5290f096d5c0dab42bc91
company,1777044959,Lowe’s Companies Inc. (LOW): One of the Best Defensive Stocks to Buy Now,139877608,https://s.yimg.com/rz/stage/p/yahoo_finance_en-US_h_p_finance_2.png,LOW,Yahoo,"We just covered the 14 Best Defensive Stocks to Invest In Now and Lowe’s Companies, Inc. (NYSE:LOW) ranks 3rd on this list. Lowe’s Companies, Inc. (NYSE:LOW) is viewed as a top defensive stock, particularly in the housing-adjacent retail space. While it shares many similarities with Home Depot, Lowe’s is often considered more defensive due to […]",https://finnhub.io/api/news?id=c101fa05b3529296dc47ae3a48b87a1a35db3f2a949ee4bf0c01e6a50cd87f1b
company,1777037725,10 Consumer Discretionary Stocks With Whale Alerts In Today's Session,139881135,https://cdn.benzinga.com/files/images/story/2025/11/06/aggregated_options_1.jpg?width=2048&height=1536,LOW,Benzinga, ,https://finnhub.io/api/news?id=0cd51eb2afc20e83fac6b0964b88fc9d6ef2bd01b0db99da988c7d1dcfa7cf89
company,1777033800,"Alpine Income Property Trust, Inc. Q1 2026 Earnings Call Summary",139879411,https://s.yimg.com/rz/stage/p/yahoo_finance_en-US_h_p_finance_2.png,LOW,Yahoo,"Moby summary of Alpine Income Property Trust, Inc.'s Q1 2026 earnings call",https://finnhub.io/api/news?id=bf7994183e5807251967cd10dcf46a28d00e510561fe7643fddda21a3e7a84a5
company,1777032295,What to Expect From Lowe's Companies' Next Quarterly Earnings Report,139880763,https://s.yimg.com/rz/stage/p/yahoo_finance_en-US_h_p_finance_2.png,LOW,Yahoo,"Lowe's Companies is expected to release its fiscal first-quarter earnings later next month, and analysts project a single-digit profit rise.",https://finnhub.io/api/news?id=f81e8e8bc5c381385e7b4f01db87e3a534692ce9e3cf34972d2b936de12761f9
company,1777022640,"Lowe’s taps tech to unify inventory planning, replenishment",139876453,https://s.yimg.com/rz/stage/p/yahoo_finance_en-US_h_p_finance_2.png,LOW,Yahoo,The retailer is expanding its partnership with Relex Solutions to improve in-stock levels using an AI-driven platform to analyze demand trends and positioning.,https://finnhub.io/api/news?id=40a04324b1ace18110409da9cb1d7fe7c6ab849b594f9ac334f34985c362a4fd
