category,datetime,headline,id,image,related,source,summary,url
company,1777059595,Philip Morris (PM) Lowers Forecast as Zyn Faces Approval Hurdles,139880625,https://s.yimg.com/rz/stage/p/yahoo_finance_en-US_h_p_finance_2.png,PM,Yahoo,"Philip Morris International Inc. (NYSE:PM) is included among the 10 Best Bear Market Stocks to Invest in Right Now. On April 22, Reuters reported that Philip Morris International Inc. (NYSE:PM) lowered its annual profit forecast amid regulatory uncertainty around its Zyn nicotine pouches and rising competition in tobacco products. The company has been pushing to [вҖҰ]",https://finnhub.io/api/news?id=e1bf75bac9be594db66a7660ff7d5c46eb3d44fe5f917e150e403df12f0c9c2a
company,1777052219,GDVвҖҷs $1.80 annual payout faces a hidden test as leverage amplifies market risk,139880497,https://s.yimg.com/rz/stage/p/yahoo_finance_en-US_h_p_finance_2.png,PM,Yahoo,"The Gabelli Dividend & Income Trust (NYSE:GDV) has pushed to an all-time high of roughly $29, with shares changing hands at about $29 and annual distributions stepped up to $1.80 per share. This article examines whether the monthly payout is backed by durable cash flow from the underlying portfolio, or whether the rally has pulled ... GDVвҖҷs $1.80 annual payout faces a hidden test as leverage amplifies market risk",https://finnhub.io/api/news?id=7b2836b1c9b9bf4c9f8c4123f63d7f16b329b85ec204638067b2caac6bece4ed
company,1777022295,Philip Morris International : Presentation (f40672),139875862,,PM,Finnhub,"Championing a Smoke-Free World 2026 First-Quarter Results April 22, 2026 ...",https://finnhub.io/api/news?id=912cf67563e5b474b7af46bba9fa8ecf69b8e7c3efa7e71279c01b749fe1f49c
company,1777022294,Philip Morris International : Glossary & Non-GAAP Reconciliations (43e7a2),139875864,,PM,Finnhub,"вҖҢPhilip Morris International Inc. Glossary of Key Terms, Definitions and Explanatory Notes; and Select Financial Information and Reconciliations of Non-GAAP Financial...",https://finnhub.io/api/news?id=391734427dad95e591930b2c1c5fd084a8dcf02f35577e6e6b7b2a4897a7ba15
company,1777022294,Philip Morris International : Script (1519e4),139875863,,PM,Finnhub,"вҖҢPhilip Morris International Inc. 2026 First-Quarter Conference Call April 22, 2026 JAMES BUSHNELL Welcome. Thank you...",https://finnhub.io/api/news?id=3271bd834f898c11df41ea56012ed08ed60eb90d9bea210e7a15e8e6b5724673
company,1777022172,Philip Morris International : Press Release (6e8e22),139875855,,PM,Finnhub,вҖҢPRESS RELEASE Philip Morris International Reports 2026 First-Quarter Results and Updates 2026 Full-Year Adjusted Diluted EPS Forecast for Currency Only;...,https://finnhub.io/api/news?id=fb1f3b0f92410595a696fbb4d1bbd25f01aa692cc86233a94f5d34a6daf5ab4e
company,1777021200,10 Dividend Growth Stocks: April 2025,139875789,https://static.seekingalpha.com/cdn/s3/uploads/getty_images/2206214872/image_2206214872.jpg?io=getty-c-w1536,PM,SeekingAlpha,"Ranked top 10 dividend growth stocks with 3.3%+ yields using a new 9-factor, 10-point quality scoring systemГўВҖВ”find todayГўВҖВҷs best picks now.",https://finnhub.io/api/news?id=bde21a277e5ed38e7a7120e2fc7fd3a870216ab8961356c8b3fd11058bf254a4
company,1777018927,Philip Morris International Q1 Earnings Call Highlights,139874314,https://s.yimg.com/rz/stage/p/yahoo_finance_en-US_h_p_finance_2.png,PM,Yahoo,"Philip Morris International (NYSE:PM) reported what Chief Financial Officer Emmanuel Babeau described as a вҖңstrong start to the year,вҖқ driven by growth in its international smoke-free business and вҖңvery robust pricing.вҖқ On the companyвҖҷs 2026 first-quarter results call, Babeau said organic net revenu",https://finnhub.io/api/news?id=721f438e4a8e38a2d897aec310220705075c518c997126d98371c81c012f6531
