category,datetime,headline,id,image,related,source,summary,url
company,1777074900,"This Week's Market Wrap: Strong Earnings, Ceasefire Uncertainty, And Creeping Inflation",139883992,https://static.seekingalpha.com/cdn/s3/uploads/getty_images/2182036952/image_2182036952.jpg?io=getty-c-w1536,UAL,SeekingAlpha,"Semiconductor strength led by Intel and Texas Instruments drove index-level gains, while weak guidance and capex concerns punished software and select industrial names.",https://finnhub.io/api/news?id=a8e709f83485f7ea819169cd26523a4fefcdfd125d4448ec7a08a7523eb6b2fb
company,1777037346,Clock ticks on Spirit Airlines as bondholders weigh Trump bailout. Here's what could happen next,139879088,https://image.cnbcfm.com/api/v1/image/108063980-1731706719266-gettyimages-2171702447-lax_airplanes_040.jpeg?v=1731706850&w=1920&h=1080,UAL,CNBC,President Trump has said the government could buy Spirit.,https://finnhub.io/api/news?id=4cb954a9c1b0f8971a98cfc1b2da63a9a71423b18c71041cd587903fa703a11e
company,1777023553,Chevron CEO Expects Air Travel To 'Get Worse' Over The Next Few Weeks As Hormuz Crisis Pushes Fuel Costs Higher,139878204,https://cdn.benzinga.com/files/images/story/2026/04/24/Vueling-Plane-Approaxing-Bcn-Airport-Fro.jpeg?width=2048&height=1536,UAL,Benzinga,"Chevron CEO warns Iran war could push up jet fuel prices, raising airfare costs and cutting flight availability as markets tighten globally.",https://finnhub.io/api/news?id=559d108ed74b87e6575b3298c263b0626680711053cfc729c3b39505aeef9c4c
company,1777003043,"Stocks making big moves yesterday: Best Buy, FuelCell Energy, United Airlines, Taylor Morrison Home, and Apple",139872050,https://s.yimg.com/rz/stage/p/yahoo_finance_en-US_h_p_finance_2.png,UAL,Yahoo,Check out the companies making headlines yesterday:,https://finnhub.io/api/news?id=9170e639f1af45fb0c3ad7a1255d3bddff9af4f812916f63defe51ada89d29a2
company,1776998685,Elizabeth Warren Slams United's Proposed 'Mega-Merger' With American Airlines: 'I'm Pushing Back',139879863,https://cdn.benzinga.com/files/images/story/2026/04/24/Phoenix--Az---December-7--2019-Photo-Of-.jpeg?width=2048&height=1536,UAL,Benzinga,"Elizabeth Warren has criticized United CEO&#39;s proposed merger with American Airlines, citing lack of competition in the aviation industry.",https://finnhub.io/api/news?id=00c5707d4982a6d6df3a711f4d686c64fb9ce6f22db15edc9f422462d13c33f2
