category,datetime,headline,id,image,related,source,summary,url
company,1776974442,"Medtronic: Is This Dividend Aristocrat Finally A ""Buy"" Before Earnings?",139870699,https://static.seekingalpha.com/cdn/s3/uploads/getty_images/2205706076/image_2205706076.jpg?io=getty-c-w1536,BSX,SeekingAlpha,"Medtronic plc stock: hold amid slow growth, high debt and competition. Click for this MDT update and a look at recent whether it is a good value after its selloff.",https://finnhub.io/api/news?id=654a58a01b4e69dab086db198d42a3791f06a2a112901c1e6ad482be0ccd9744
company,1776964300,Boston Scientific Just Slashed Guidance and Wall Street Followed. Is the Pullback a Buying Opportunity?,139866436,https://s.yimg.com/rz/stage/p/yahoo_finance_en-US_h_p_finance_2.png,BSX,Yahoo,"Boston Scientific (NYSE:BSX) stock has taken a beating in 2026 after management cut full-year guidance on Wednesday. On Thursday, three major firms trimmed price targets while keeping bullish ratings intact. The setup looks like a classic reset-the-bar, then-outperform scenario for patient investors. Wells Fargo lowered its price target on Boston Scientific stock to $75 from ... Boston Scientific Just Slashed Guidance and Wall Street Followed. Is the Pullback a Buying Opportunity?",https://finnhub.io/api/news?id=e3bacffc6705aefcef8162c9d471e2a0f2d36316c58ec1c64294c153028a67ab
company,1776960022,"Boston Scientific 2026 Guidance Cut 'Prudent,' Q2 Trough Expected, RBC Says",139866437,https://s.yimg.com/rz/stage/p/yahoo_finance_en-US_h_p_finance_2.png,BSX,Yahoo,"Boston Scientific (BSX) posted Q1 sales and earnings per share beats alongside a ""prudent"" guidance",https://finnhub.io/api/news?id=63a7d738b605f08c4568c3954e1dcc75e60d1db33f1b8352350e5a7634fb915f
company,1776959651,Why BSX Stock's Q1 Beat Is A Lagging Indicator,139866256,https://s.yimg.com/rz/stage/p/yahoo_finance_en-US_h_p_finance_2.png,BSX,Yahoo,"The primary insight within Boston Scientific’s (BSX) Q1 2026 results is that the adjusted EPS beat of $0.80 acts as a lagging indicator, contrasting with a moderating trend in forward-looking growth. While management maintained a 28.0% operating margin, the decision to revise full-year 2026 organic revenue guidance from a 10%–11% range to 6.5%–8.0% is the critical signal for investors. This dynamic highlights a strategic divergence from other healthcare leaders. For instance, while our analysis",https://finnhub.io/api/news?id=0918df89b280d5d627ab5492395fcc973d12eab45216cf30599e68d6953fd7d4
company,1776953603,BSX Q1 Deep Dive: Market Outperformance Despite Lowered Guidance and Product-Specific Headwinds,139864424,https://s.yimg.com/rz/stage/p/yahoo_finance_en-US_h_p_finance_2.png,BSX,Yahoo,"Medical device company Boston Scientific (NYSE:BSX) announced better-than-expected revenue in Q1 CY2026, with sales up 11.6% year on year to $5.20 billion. On the other hand, next quarter’s revenue guidance of $5.39 billion was less impressive, coming in 2.9% below analysts’ estimates. Its non-GAAP profit of $0.80 per share was 1.6% above analysts’ consensus estimates.",https://finnhub.io/api/news?id=3f87d0d2b6d04f37f496fa604719cd054516dc20d3e742083a8d51eb92d57cdc
company,1776951850,"Texas Instruments upgraded, Avis downgraded: Wall Street's top analyst calls",139862705,https://s.yimg.com/rz/stage/p/yahoo_finance_en-US_h_p_finance_2.png,BSX,Yahoo,"Texas Instruments upgraded, Avis downgraded: Wall Street's top analyst calls",https://finnhub.io/api/news?id=b0317730de9b89faa8acef74601ba1b1bfddede808e2672de795e7fd74ba010d
company,1776951184,"Canaccord Genuity Maintains Buy on Boston Scientific, Lowers Price Target to $71",139882587,,BSX,Benzinga,Canaccord Genuity  analyst William Plovanic   maintains Boston Scientific (NYSE:BSX) with a Buy and lowers the price target from $109 to $71.,https://finnhub.io/api/news?id=f96c9709e82e27929ddedf8564b5eb61b28e6ed7492a1cb2a604bff511cf56f9
company,1776949800,Is Innovation-Led Growth Driving ISRG's Revenues Above Procedures?,139864325,https://s.yimg.com/rz/stage/p/yahoo_finance_en-US_h_p_finance_2.png,BSX,Yahoo,"ISRG's Q1 results show revenues outpacing procedures as da Vinci 5 drives pricing power, signaling a shift toward innovation-led, value-based growth.",https://finnhub.io/api/news?id=6d9ff3b60d1f0513d94ef3b7818633b21cf34c499d5ec75ed96c1b4f5c80b2af
company,1776949796,"RBC Capital Maintains Outperform on Boston Scientific, Lowers Price Target to $100",139882588,,BSX,Benzinga,RBC Capital  analyst Shagun Singh   maintains Boston Scientific (NYSE:BSX) with a Outperform and lowers the price target from $105 to $100.,https://finnhub.io/api/news?id=a0a03cf50546fbd9dd10671b4ae99357f7157ec28d2773b3f7c311dacf8e093b
company,1776945573,"Here Are Thursday’s Top Wall Street Analyst Research Calls: Boston Scientific, Datadog, Deckers Outdoor, McDonald’s, Murphy USA, On Semiconductor, Palantir Technologies, Texas Instruments, and More",139861526,https://s.yimg.com/rz/stage/p/yahoo_finance_en-US_h_p_finance_2.png,BSX,Yahoo,"Pre-Market Stock Futures: Futures are trading lower on this Thursday, but what a difference a month makes: 30 days ago, the worries over inflation and the spiraling situation in Iran were weighing heavily on the stock market. On Wednesday, the Nasdaq Composite and S&P 500 hit new all-time highs, driven by hopes for an extended ... Here Are Thursday’s Top Wall Street Analyst Research Calls: Boston Scientific, Datadog, Deckers Outdoor, McDonald’s, Murphy USA, On Semiconductor, Palantir Technologie",https://finnhub.io/api/news?id=4dfe33b84f9c948a5d3d8911743a90b06fa51755541de2d4125bcd6661099d52
company,1776943320,"Company News for Apr 23, 2026",139862866,https://s.yimg.com/rz/stage/p/yahoo_finance_en-US_h_p_finance_2.png,BSX,Yahoo,"Companies In The Article Are: ASTS, BBY,ADBE,BSX",https://finnhub.io/api/news?id=f2fed6fe91fbda5627f71bcfbca1dfe722b2edece1d467eb80dc0d1fc9139067
company,1776942665,"BSX CLASS ACTION NOTICE: Faruqi & Faruqi, LLP Reminds Boston Scientific (BSX) Investors of Securities Class Action Deadline on May 4, 2026",139863742,,BSX,Finnhub,"Faruqi & Faruqi, LLP, a leading national securities law firm, is investigating po...",https://finnhub.io/api/news?id=fbf055b5b1633a0d188bf92fe35cf9d1af422e421c44cc390416cddab5a2caf0
company,1776942488,"Barclays Maintains Overweight on Boston Scientific, Lowers Price Target to $96",139882589,,BSX,Benzinga,Barclays  analyst Matt Miksic   maintains Boston Scientific (NYSE:BSX) with a Overweight and lowers the price target from $100 to $96.,https://finnhub.io/api/news?id=45a8238086d6a7868eeb14116fa227560e706f177a1c92ebd3c4933de9b9a5e0
company,1776941264,Boston Scientific reports steady Q1 2026 performance yet tempers FY26 outlook,139861282,https://s.yimg.com/rz/stage/p/yahoo_finance_en-US_h_p_finance_2.png,BSX,Yahoo,"Despite Boston’s Q1 performance denoting a YoY rise of 11.2%, the company has trimmed its full-year growth outlook by 2% at the top-end.",https://finnhub.io/api/news?id=17eb94dc6be2af61d235430bbc1c6ea9e3f45c828a995926b202feee8baedee0
company,1776940093,"Evercore ISI Group Maintains Outperform on Boston Scientific, Lowers Price Target to $78",139882590,,BSX,Benzinga,Evercore ISI Group  analyst Vijay Kumar   maintains Boston Scientific (NYSE:BSX) with a Outperform and lowers the price target from $80 to $78.,https://finnhub.io/api/news?id=5fc5e004dcd6e6c7705718dd76a97988813f0ce8d044d787717df42c903d6c49
company,1776938880,"Catheters Market Report 2025-2030, Profiles and Strategy Analysis of Leading Players - Abbott Laboratories, Boston Scientific, Medtronic, Terumo, and B. Braun",139861226,https://s.yimg.com/rz/stage/p/yahoo_finance_en-US_h_p_finance_2.png,BSX,Yahoo,"The catheter market is poised for significant growth due to rising chronic disease prevalence, increased minimally invasive procedures, and enhanced healthcare access in emerging regions. Opportunities lie in product innovation, particularly in advanced coatings and diagnostic features, and expansion strategies in Asia-Pacific and other developing areas. Catheters Market Catheters Market Dublin, April 23, 2026 (GLOBE NEWSWIRE) -- The ""Catheters Market"" report has been added to ResearchAndMarkets",https://finnhub.io/api/news?id=4aec750f617277fda721a041dc494b787ebba2994e3ddac514a83fe5bff5021f
company,1776937634,"Wells Fargo Maintains Overweight on Boston Scientific, Lowers Price Target to $75",139863216,,BSX,Benzinga,Wells Fargo  analyst Larry Biegelsen   maintains Boston Scientific (NYSE:BSX) with a Overweight and lowers the price target from $94 to $75.,https://finnhub.io/api/news?id=8a053e5c4af84b02647d6745b44e4a41cee864844e0215cba7007e869118cd15
company,1776934947,BSX Investor Alert: BOSTON SCIENTIFIC CORPORATION Securities Fraud Lawsuit - Investors With Losses May Seek to Lead the Class Action After Alleged Concealment of Electrophysiology Demand Weaknesses,139862114,,BSX,Finnhub,"Notice to Pension Funds, Asset Managers, and FiduciariesNEW YORK, April 23, 2026 /PRNewswire/ -- Institutional investors holding positions in Boston Scientific Corporation during the period from July...",https://finnhub.io/api/news?id=37b99b7e5a331eca39aca65abb1c56af3e32b0a06b68cdd5d5eea6cd9b4c563f
company,1776934896,Boston Scientific Analysts Slash Their Forecasts After Q1 Earnings,139863217,https://cdn.benzinga.com/files/images/story/2026/04/23/Sep-16--2019-Fremont-----Ca-----Usa---Bo.jpeg?width=2048&height=1536,BSX,Benzinga,"BSX reported positive Q1 earnings, beating estimates and maintaining strong sales growth. Analysts have lowered price targets but remain bullish.",https://finnhub.io/api/news?id=6047eabd4ecd71d0fc51fd372ee699c2dfb572341f580a983c632470524b484e
company,1776934295,GE Vernova To Rally More Than 24%? Here Are 10 Top Analyst Forecasts For Thursday,139863218,https://cdn.benzinga.com/files/images/story/2026/04/23/GE-Vernova-Inc-.jpeg?width=2048&height=1536,BSX,Benzinga,"Top Wall Street analysts changed their outlook on top names. See analyst ratings page for all changes. H raised, SYF, PEGA, HSY lowered, NOW, WEX, MAS raised.",https://finnhub.io/api/news?id=71c591082660b88d2faf8899b4034dc61decd7f3833760ee8080f11a9560960e
company,1776931870,"Truist Securities Maintains Buy on Boston Scientific, Lowers Price Target to $85",139863219,,BSX,Benzinga,Truist Securities  analyst Richard Newitter   maintains Boston Scientific (NYSE:BSX) with a Buy and lowers the price target from $90 to $85.,https://finnhub.io/api/news?id=714c507cef16420f0f4967a3bef9276dea33bdeeeb6d2b544b32bdd3b88f47f6
company,1776927779,Boston Scientific Corp (BSX) Q1 2026 Earnings Call Highlights: Strong Sales Growth Amid ...,139859131,https://s.yimg.com/rz/stage/p/yahoo_finance_en-US_h_p_finance_2.png,BSX,Yahoo,"Boston Scientific Corp (BSX) reports robust Q1 2026 results with 9.4% organic sales growth, while addressing challenges in key segments.",https://finnhub.io/api/news?id=81ace4d60004a74a1524b231b16e040eda2eeaa971cff927b9bfc499071f4582
company,1776927563,"Baird Maintains Outperform on Boston Scientific, Lowers Price Target to $78",139863220,,BSX,Benzinga,Baird  analyst David Rescott   maintains Boston Scientific (NYSE:BSX) with a Outperform and lowers the price target from $86 to $78.,https://finnhub.io/api/news?id=6d2cdb6b8f2561ab3365191b7429b29107c2716be96da5fb824f71488a822c2b
company,1776922994,"Goldman Sachs Maintains Buy on Boston Scientific, Lowers Price Target to $84",139863221,,BSX,Benzinga,Goldman Sachs  analyst David Roman   maintains Boston Scientific (NYSE:BSX) with a Buy and lowers the price target from $87 to $84.,https://finnhub.io/api/news?id=88ca760d8eee24668ddf68d5ad1951b3487645613e35e8f248e381c518360271
company,1776922535,"Needham Maintains Buy on Boston Scientific, Lowers Price Target to $77",139863222,,BSX,Benzinga,Needham  analyst Mike Matson   maintains Boston Scientific (NYSE:BSX) with a Buy and lowers the price target from $97 to $77.,https://finnhub.io/api/news?id=a37c5f17a236ea0ec0a96eaadb62a54ee6415807b39e87f3779f230e6033bb4a
company,1776918595,Is It Time To Reassess Boston Scientific (BSX) After Its Recent Share Price Slide,139858248,https://s.yimg.com/rz/stage/p/yahoo_finance_en-US_h_p_finance_2.png,BSX,Yahoo,"If you are wondering whether Boston Scientific's current share price lines up with its underlying worth, this breakdown is designed to help you assess what you are really paying for. The stock recently closed at US$64.87, with returns of 0.4% over 7 days, a 6.7% decline over 30 days, a 31.5% decline year to date, and a 34.4% decline over 1 year, set against gains of 26.9% over 3 years and 46.6% over 5 years. These moves sit alongside ongoing attention on Boston Scientific's role in medical...",https://finnhub.io/api/news?id=4cda42ba48984e0de67435cda3d4cd196e515e6ef3e15e49b642199920830744
