category,datetime,headline,id,image,related,source,summary,url
company,1776970560,"MOH Q1 EPS Tops Estimates on Lower Medical Costs, Membership Declines",139867935,https://s.yimg.com/rz/stage/p/yahoo_finance_en-US_h_p_finance_2.png,CI,Yahoo,"Molina Healthcare beats Q1 EPS estimates, but profits plunge 61% as revenues dip, membership shrinks and premiums decline despite lower medical costs support.",https://finnhub.io/api/news?id=63710636226215529e21b714a152b7f2197cb84343f835806fdbad73fe372c66
company,1776965975,Healthcare Services Group Q1 Earnings Call Highlights,139866455,https://s.yimg.com/rz/stage/p/yahoo_finance_en-US_h_p_finance_2.png,CI,Yahoo,"Healthcare Services Group (NASDAQ:HCSG) reported what CEO Ted Wahl described as a “strong” start to fiscal 2026, citing growth in revenue, earnings, and cash flow as new client wins and high retention supported year-over-year gains. Quarterly results and segment performance Chief Communications Off",https://finnhub.io/api/news?id=2456054fc8626f4445b98ffd6cd9e4c6ed4a7db7b0adff3ef841d938c030d814
company,1776959340,Will Increasing Operating Costs Affect Humana's Q1 Earnings?,139866456,https://s.yimg.com/rz/stage/p/yahoo_finance_en-US_h_p_finance_2.png,CI,Yahoo,"HUM heads into Q1 earnings with strong revenue growth expectations, but rising operating costs and a higher benefits ratio may weigh on profits.",https://finnhub.io/api/news?id=9d8c7832a045e777e7f98862dc58bed82651f8edbac199b74791a09122e394ef
company,1776952819,Cigna (CI) Reports Next Week: Wall Street Expects Earnings Growth,139864454,https://s.yimg.com/rz/stage/p/yahoo_finance_en-US_h_p_finance_2.png,CI,Yahoo,Cigna (CI) possesses the right combination of the two key ingredients for a likely earnings beat in its upcoming report. Get prepared with the key expectations.,https://finnhub.io/api/news?id=74265c6f552c0d0437cea136fdc838d6abde67982131cabc3a9d7b98fd25e34b
company,1776949207,Why Investors Need to Take Advantage of These 2 Medical Stocks Now,139864455,https://s.yimg.com/rz/stage/p/yahoo_finance_en-US_h_p_finance_2.png,CI,Yahoo,The Zacks Earnings ESP is a great way to find potential earnings surprises. Why investors should take advantage now.,https://finnhub.io/api/news?id=897777762db0d52ce7f758534c07bc9fb886e3567644567bbba0fd466105f269
