category,datetime,headline,id,image,related,source,summary,url
company,1776978305,Top gainers and losers in the S&P500 index during Thursday's after-hours session.,139868966,https://www.chartmill.com/images/uploads/CM_Aftermarket_Movers_Small_free_e077945a19.webp,CLX,ChartMill,"After the closing bell on Thursday, let's take a glimpse of the US markets and explore the top S&P500 gainers and losers in today's after-hours session.",https://finnhub.io/api/news?id=474f9719a63f2cf5e533e58b0e536b186c53c96194e1e0278b99430c7ca4aced
company,1776960120,Clorox to Report Q3 Earnings: Here's What You Should Know,139866619,https://s.yimg.com/rz/stage/p/yahoo_finance_en-US_h_p_finance_2.png,CLX,Yahoo,"CLX heads into Q3 earnings with rising costs, soft demand and margin pressure, even as its IGNITE strategy and cost savings initiatives aim to stabilize performance.",https://finnhub.io/api/news?id=7a33471a7db7078a3e8e709a96cf5822c7a6ba5948cb2d61d7126e84f8e7cac8
company,1776952829,Clorox (CLX) Earnings Expected to Grow: What to Know Ahead of Next Week's Release,139864663,https://s.yimg.com/rz/stage/p/yahoo_finance_en-US_h_p_finance_2.png,CLX,Yahoo,Clorox (CLX) doesn't possess the right combination of the two key ingredients for a likely earnings beat in its upcoming report. Get prepared with the key expectations.,https://finnhub.io/api/news?id=30f50f0b38dd110a53c8b873f8edde6e17178ccdaa5e9f85ff7b5445fef75157
company,1776951300,"Morgan Stanley Maintains Equal-Weight on Clorox, Lowers Price Target to $110",139867195,,CLX,Benzinga,Morgan Stanley  analyst Dara Mohsenian   maintains Clorox (NYSE:CLX) with a Equal-Weight and lowers the price target from $136 to $110.,https://finnhub.io/api/news?id=101c787335ef21f0b92377fe1e90abbdf314b42273fe5f1496a69515fd67d647
company,1776931200,"Fed Rate Raise, Pause, Or Cut At Next Week's Meeting?",139861493,https://static.seekingalpha.com/cdn/s3/uploads/getty_images/1477463465/image_1477463465.jpg?io=getty-c-w1536,CLX,SeekingAlpha,The upcoming FOMC meeting is expected to maintain rates at 350-375 bps. Read what justifies a rate pause and more about the market outlook here.,https://finnhub.io/api/news?id=9cf7bdfed76a139746c11298ba465cb60d3c7bdf3a18143ffa239745b11cdbc6
