category,datetime,headline,id,image,related,source,summary,url
company,1776959107,Shares of companies in the broader tech sector are trading lower amid possible sympathy with ServiceNow and IBM.,139867620,,CTSH,Benzinga,,https://finnhub.io/api/news?id=07505da7f757ef9cdebcfe124aae296dc659a8a9b64b138d963c6b84396a86fb
company,1776949200,"Cognizant AI Lab Earns Three New U.S. Patents, Totaling 65 U.S. Patents and 88 International Patents",139863004,https://s.yimg.com/rz/stage/p/yahoo_finance_en-US_h_p_finance_2.png,CTSH,Yahoo,"Cognizant (NASDAQ: CTSH) today announced that its AI Lab has received three new U.S. patents, bringing its total number of U.S. patents to 65 and 88 globally.",https://finnhub.io/api/news?id=33b91a1195aa4bb6d50ce39f7bce68078c7595fa16cb1c7c1b91d2692b0c5347
company,1776941184,Cognizant and OpenAI Partner to Reshape Enterprise Software Engineering with Codex,139863399,,CTSH,Finnhub,"Recognized by OpenAI for its AI builder capabilities, Cognizant is embedding Codex across its global software engineering organization and working with OpenAI to bring Codex-driven development to...",https://finnhub.io/api/news?id=3db920a7f6548f6718b66942622e8784a7495d9fc1c5af8ee73a400e26788cce
company,1776941183,Cognizant Propels AI Workforce Training with Cognizant Skillspring: New Talent Transformation Platform Designed to Accelerate Clients' Workforce AI Readiness,139863401,,CTSH,Finnhub,"New AI-native platform equips organizations to achieve AI fluency, aligns workforce capabilities with the demands of an AI-powered economy and drives outcome-based learning tailored to business...",https://finnhub.io/api/news?id=07ae6ba3fd3b5482d1adaa03f3929c0132a1de24e165bb1f9cf1c34aed128958
company,1776941183,Cognizant joins J.P. Morgan Payments Consultant Implementation Program,139863400,,CTSH,Finnhub,"Clients can leverage Cognizant to accelerate implementation of J.P. Morgan Payments solutions.Cognizant , a leading AI builder and technology services provider, announced today that it has joined the...",https://finnhub.io/api/news?id=808532bd698474e7ef9fb27cc5a9f457fc47eef6f5200963db323df47d118fd4
company,1776935183,"Cognizant's AI Lab Receives Three New U.S. Patents, Bringing Its Total Number Of U.S. Patents To 65 And 88 Globally",139866675,,CTSH,Benzinga,"Cognizant (NASDAQ:CTSH) today announced that its AI Lab has received three new U.S. patents, bringing its total number of U.S. patents to 65 and 88 globally.The newly granted patents build on the lab&#39;s work in areas such",https://finnhub.io/api/news?id=1b342e00a82e7f2398f617b4dfb8318b2c7678fc86d8f9d173708eb3f5e79ca1
