category,datetime,headline,id,image,related,source,summary,url
company,1776970560,"MOH Q1 EPS Tops Estimates on Lower Medical Costs, Membership Declines",139867935,https://s.yimg.com/rz/stage/p/yahoo_finance_en-US_h_p_finance_2.png,ELV,Yahoo,"Molina Healthcare beats Q1 EPS estimates, but profits plunge 61% as revenues dip, membership shrinks and premiums decline despite lower medical costs support.",https://finnhub.io/api/news?id=63710636226215529e21b714a152b7f2197cb84343f835806fdbad73fe372c66
company,1776953803,"Elevance Health shares are trading higher after Baird maintained its Neutral rating on the stock and raised its price target from $317 to $331. Also, Evercore ISI Group maintained its In-Line rating on the stock and raised its  price target from $345 to $360.",139870122,,ELV,Benzinga,,https://finnhub.io/api/news?id=fc7c20b5e34475d72e94fcb71164ba8a3bf05c48e613362c1cbe689dec79056a
company,1776951851,Elevance Health : First Quarter 2026 Q1 2026 Earnings Transcript,139866042,,ELV,Finnhub,"‌LSEG STREETEVENTS EDITED TRANSCRIPT ELV.N - Q1 2026 Elevance Health Inc Earnings Call EVENT DATE/TIME: APRIL 22, 2026 / 12:30PM GMT ...",https://finnhub.io/api/news?id=631dc472b1d77d4317c444b629a00426381f076757b32ceb593233e2cdd37995
company,1776945832,Molina controls costs in Q1 but future Medicaid spending in doubt,139866289,https://s.yimg.com/rz/stage/p/yahoo_finance_en-US_h_p_finance_2.png,ELV,Yahoo,The insurer beat analyst expectations for adjusted earnings in the first quarter. But steeper Medicaid membership losses than expected could saddle Molina with higher costs down the line.,https://finnhub.io/api/news?id=503c7d564487427488078e5203b8ac4984d49d2759a1bd8691d651a705c7a175
company,1776942563,ELV Q1 Deep Dive: Operating Discipline and AI Integration Drive Margin Expansion,139861309,https://s.yimg.com/rz/stage/p/yahoo_finance_en-US_h_p_finance_2.png,ELV,Yahoo,"Health insurance provider Elevance Health (NYSE:EVH) reported Q1 CY2026 results topping the market’s revenue expectations, with sales up 2.9% year on year to $50.18 billion. Its non-GAAP profit of $12.58 per share was 16.4% above analysts’ consensus estimates.",https://finnhub.io/api/news?id=be003c1c36d659878e7d322788ac7a4ad03af1a373a834e8311fc91f7cd0cde8
company,1776940282,"Evercore ISI Group Maintains In-Line on Elevance Health, Raises Price Target to $360",139870123,,ELV,Benzinga,Evercore ISI Group  analyst Elizabeth Anderson   maintains Elevance Health (NYSE:ELV) with a In-Line and raises the price target from $345 to $360.,https://finnhub.io/api/news?id=d542e8f93ffbd45b6ec61731647a67ac07d6c4623b188bc9c0d1b9feb627d9b2
company,1776927774,Elevance Health Inc (ELV) Q1 2026 Earnings Call Highlights: Strong EPS Growth and Raised Guidance,139859143,https://s.yimg.com/rz/stage/p/yahoo_finance_en-US_h_p_finance_2.png,ELV,Yahoo,"Elevance Health Inc (ELV) surpasses expectations with robust earnings, increased guidance, and strategic advancements in AI and care delivery.",https://finnhub.io/api/news?id=9bb4deb2876a045f6c81bb6d8d016c815b66bd431a032919babe4c21d58884f8
company,1776927719,"Baird Maintains Neutral on Elevance Health, Raises Price Target to $331",139870124,,ELV,Benzinga,Baird  analyst Michael Ha   maintains Elevance Health (NYSE:ELV) with a Neutral and raises the price target from $317 to $331.,https://finnhub.io/api/news?id=16737da69abee58e0551cce0a5208ae80bdaa0f676cebcea5f4fd322c04d19aa
company,1776924803,Why Are agilon health (AGL) Shares Soaring Today,139859144,https://s.yimg.com/rz/stage/p/yahoo_finance_en-US_h_p_finance_2.png,ELV,Yahoo,Shares of healthcare services company Agilon Health (NYSE:AGL) jumped 12.6% in the afternoon session after positive earnings reports from peers in the healthcare sector lifted investor sentiment for the industry.,https://finnhub.io/api/news?id=351e3d877c4c5646f0eb75d1b9d35833623ce36ef40eb198ef68798a279ba7c0
