category,datetime,headline,id,image,related,source,summary,url
company,1776975300,Erie Indemnity Reports First Quarter 2026 Results,139869657,https://s.yimg.com/rz/stage/p/yahoo_finance_en-US_h_p_finance_2.png,ERIE,Yahoo,"Erie Indemnity Company (NASDAQ: ERIE) today announced financial results for the quarter ending March 31, 2026. Net income was $150.5 million, or $2.88 per diluted share, in the first quarter of 2026, compared to $138.4 million, or $2.65 per diluted share, in the first quarter of 2025.",https://finnhub.io/api/news?id=4c7c0dd0add592bc2bc3e96e09237ab8bdb5173f06af02b0f2e864ebed7a1840
company,1776965308,Erie Indemnity : 2026 1st Quarter Investor Supplement,139869024,,ERIE,Finnhub,ERIE INDEMNITY COMPANY Investor Supplement First Quarter 2026 This report is for informational purposes only and includes financial statements and financial...,https://finnhub.io/api/news?id=de9be677ee31c689fb83b14c60aea3bda35247b9c99bbadadb5990cf13f2507c
company,1776964880,Insurer Erie Indemnity's profit rises on higher investment income,139869006,,ERIE,Finnhub,"Property and casualty insurer ErieIndemnity reported a rise in first-quarter profit onThursday, helped by strong growth in investment income and fees. Insurance demand remains...",https://finnhub.io/api/news?id=66ac03a39e480c464d48d2199db73b55b1ba688052e301ccf5c23ed99274fb6b
company,1776961570,Erie Indemnity: Q1 Earnings Snapshot,139868411,,ERIE,Finnhub,"ERIE, Pa. — ERIE, Pa. — Erie Indemnity Co. on Thursday reported profit of $150.5 million in its first quarter. On a per-share basis, the Erie, Pennsylvania-based company said it had net...",https://finnhub.io/api/news?id=c2fe60d455b4085704606b7aa9c83f1de5689364d1994fb52334cd968fb24447
company,1776961155,"Erie Indemnity Q1 EPS $2.88 Misses $3.06 Estimate, Sales $1.012B Beat $975.562M Estimate",139880076,,ERIE,Benzinga,Erie Indemnity (NASDAQ:ERIE) reported quarterly earnings of $2.88 per share which missed the analyst consensus estimate of $3.06 by 5.88 percent. This is a 8.68 percent increase over earnings of $2.65 per share from the,https://finnhub.io/api/news?id=0f3e5ac03ef487db0241d4995a6ead5ea0704fe2b6272f2c0666394722c07588
company,1776928289,"Earnings Scheduled For April 23, 2026",139863224,https://cdn.benzinga.com/files/images/story/2025/11/06/earnings_scheduled_1.jpg?width=2048&height=1536,ERIE,Benzinga, ,https://finnhub.io/api/news?id=8c563fc2379fa00c5d61da639c5622b1afb5e4f0e546029b6c462f78a95936f6
