category,datetime,headline,id,image,related,source,summary,url
company,1776967312,Is Sezzle Inc. (SEZL) A Good Stock To Buy Now?,139868003,https://s.yimg.com/rz/stage/p/yahoo_finance_en-US_h_p_finance_2.png,FICO,Yahoo,"Is SEZL a good stock to buy? We came across a bullish thesis on Sezzle Inc. on FluentInQuality’s Substack. In this article, we will summarize the bulls’ thesis on SEZL. Sezzle Inc.’s share was trading at $82.27 as of April 21st. SEZL’s trailing and forward P/E were 22.10 and 17.18 respectively according to Yahoo Finance. Sezzle Inc. […]",https://finnhub.io/api/news?id=56b32bb15089a4ef6fbc01105316761f5a6885db5cd291bb68f0af992ddee576
company,1776963949,VantageScore 4.0 And AI Fundamentally Threaten Fair Isaac,139868799,https://static.seekingalpha.com/cdn/s3/uploads/getty_images/2242192432/image_2242192432.jpg?io=getty-c-w1536,FICO,SeekingAlpha,"Fair Isaac Corporation faces existential threats from VantageScore 4.0 and AI, undermining its historic moat and pricing power. Read more on FICO stock here.",https://finnhub.io/api/news?id=077dc38606a340a31bdf77782bd8647d1cbca486cc25b1dc16d84a1cb672c466
company,1776961757,"UBS Maintains Neutral on Fair Isaac, Lowers Price Target to $1150",139870249,,FICO,Benzinga,UBS  analyst Kevin Mcveigh   maintains Fair Isaac (NYSE:FICO) with a Neutral and lowers the price target from $1200 to $1150.,https://finnhub.io/api/news?id=286166d648b03ea3e778d47d23d22e7dee969ffba49d9caa419622ab27abdd3d
company,1776946800,FICO Isn’t the Only Credit Score  for Mortgages Anymore. Fair Isaac Stock Drops.,139866570,https://s.yimg.com/rz/stage/p/yahoo_finance_en-US_h_p_finance_2.png,FICO,Yahoo,The move could open the housing market to more Americans but challenges Fair Isaac’s control of the mortgage market.,https://finnhub.io/api/news?id=fe37d36ccea2dfa5813ae2b01dde44f5359bb77c0ba79d900c0f155e0afa3381
company,1776941040,"Tesla, ServiceNow Show Risks of Relying on Big Tech Earnings. Here’s the Silver Lining.",139861092,https://s.yimg.com/rz/stage/p/yahoo_finance_en-US_h_p_finance_2.png,FICO,Yahoo,"Elon Musk says spending will rise, jet fuel shortage could crimp summer travel plans, Netflix to roll out new videos for mobile devices, and more news to start your day.",https://finnhub.io/api/news?id=526c4f8539499bb744e65e0a709f07f483f4f25985934bebf391edc886da38eb
company,1776940367,"Wells Fargo Maintains Overweight on Fair Isaac, Lowers Price Target to $1650",139870250,,FICO,Benzinga,Wells Fargo  analyst Jason Haas   maintains Fair Isaac (NYSE:FICO) with a Overweight and lowers the price target from $2300 to $1650.,https://finnhub.io/api/news?id=b95724a4bd2e76f8a2da61a574ff7e785d3ba43f8174f8634ab1a47596e6919c
company,1776914917,"Fannie Mae, Freddie Mac Move Beyond FICO With New Credit Scoring Model To Boost Competition",139865336,https://cdn.benzinga.com/files/images/story/2026/04/23/Portland--Or--Usa---Apr-12--2022-Homepag.jpeg?width=2048&height=1536,FICO,Benzinga,"Freddie Mac, Fannie Mae to accept VantageScore 4.0 mortgages, aiming to cut costs and boost credit scoring competition.",https://finnhub.io/api/news?id=78a8cfa14dd7d9dbe92d421bc1eeab2eba90b7e31b6d338f5daba16100378939
