category,datetime,headline,id,image,related,source,summary,url
company,1776971843,"Jacobs Solutions (J): Buy, Sell, or Hold Post Q4 Earnings?",139868036,https://s.yimg.com/rz/stage/p/yahoo_finance_en-US_h_p_finance_2.png,J,Yahoo,"Jacobs Solutions’s stock price has taken a beating over the past six months, shedding 20.9% of its value and falling to $127.17 per share. This may have investors wondering how to approach the situation.",https://finnhub.io/api/news?id=d556c5ebcc27484065750b28217f830f7615db377c1efbc1fb91f479c3987835
company,1776933000,Jacobs appointed to strategic UK energy framework for Murphy,139860093,https://s.yimg.com/rz/stage/p/yahoo_finance_en-US_h_p_finance_2.png,J,Yahoo,"DALLAS, April 23, 2026--Jacobs was awarded a comprehensive, eight-year multi-disciplinary framework by Murphy to assist on projects within its SSEN Transmission portfolio.",https://finnhub.io/api/news?id=b75095bb93c8b2a54423a044e33414acfa6a7fe055bb11588c9addfba6b2b78f
company,1776928071,Is Jacobs Solutions (J) Price Missing The Signal From DCF Versus High P/E Ratio,139859172,https://s.yimg.com/rz/stage/p/yahoo_finance_en-US_h_p_finance_2.png,J,Yahoo,"For investors considering whether Jacobs Solutions at around US$127.55 represents fair value or a potential opportunity, this article examines what the current share price may be implying. The stock has been relatively steady in the short term, with a 0.2% return over 7 days, a 1.3% decline over 30 days, a 5.8% decline year to date and a 9.2% gain over the last year. These figures may shape how you think about risk and reward today. Recent coverage has focused on how Jacobs Solutions fits...",https://finnhub.io/api/news?id=cb83c6c63ea5364f845402824d1eb5b01dadc0b017031c81df28293b2e531bf9
company,1776923448,Jacobs Receives Eight-Year Multi-Disciplinary Framework from Murphy,139859871,,J,Finnhub,"Jacobs was awarded a comprehensive, eight-year multi-disciplinary framework by Murphy to assist on projects within its SSEN Transmission portfolio. The framework encompasses numerous transmission and...",https://finnhub.io/api/news?id=a108732444c7b7fbcfb6a8bd27c807dfc0dc75487b3557e4d225da2adf7a9262
company,1776920783,Jacobs Wins Eight-Year Multi-Disciplinary Framework From Murphy To Support SSEN Transmission Portfolio Across UK Energy Transition Infrastructure Projects,139867003,,J,Benzinga,,https://finnhub.io/api/news?id=fe3e922d1f1dda281711f92d8743d83d9910f0923f3bd3208f5c4e21a6cc6389
