category,datetime,headline,id,image,related,source,summary,url
company,1776958560,Xylem Gears Up to Report Q1 Earnings: What's in the Offing?,139866261,https://s.yimg.com/rz/stage/p/yahoo_finance_en-US_h_p_finance_2.png,MA,Yahoo,"XYL heads into Q1 results with modest revenue and EPS growth expected, backed by infrastructure demand and acquisitions despite cost pressures.",https://finnhub.io/api/news?id=bb06935e4517760a268e38924b49661a5ee9ace408d80d9943f3b9cbbecff4e4
company,1776952820,MasterCard (MA) Reports Next Week: Wall Street Expects Earnings Growth,139864192,https://s.yimg.com/rz/stage/p/yahoo_finance_en-US_h_p_finance_2.png,MA,Yahoo,MasterCard (MA) possesses the right combination of the two key ingredients for a likely earnings beat in its upcoming report. Get prepared with the key expectations.,https://finnhub.io/api/news?id=d18db39761c6a5c4f6174cd240bb54e9498355249a82df845e9b235066991eec
company,1776949210,How to Boost Your Portfolio with Top Business Services Stocks Set to Beat Earnings,139864203,https://s.yimg.com/rz/stage/p/yahoo_finance_en-US_h_p_finance_2.png,MA,Yahoo,The Zacks Earnings ESP is a great way to find potential earnings surprises. Why investors should take advantage now.,https://finnhub.io/api/news?id=c22d5d866d3fe5254b20886bdc411a76852e60927460064345595ec95d5009c4
company,1776949200,Our Tech Ambition: Scaling the Digital Economy Without Scaling Emissions,139862684,https://s.yimg.com/rz/stage/p/yahoo_finance_en-US_h_p_finance_2.png,MA,Yahoo,"How carbon-aware software engineering and hardware optimization are reshaping how Mastercard builds, runs and measures its technology stack. NORTHAMPTON, MA / ACCESS Newswire / April 23, 2026 / Renewable energy at Mastercard's facilities, such as ...",https://finnhub.io/api/news?id=0b86e4279ee91aef47c7cab6b019b0680be02fe328bb4c123a032f0f0891401f
company,1776947466,"Mastercard grows revenue, reduces emissions for third straight year",139866262,https://s.yimg.com/rz/stage/p/yahoo_finance_en-US_h_p_finance_2.png,MA,Yahoo,The global payments company also said it achieved its 2025 emission reduction targets for its direct and indirect operations in an Earth Day blog.,https://finnhub.io/api/news?id=e6c42a319395209cd4a7a688b501cd488546d53f39e9a3555ecb9aa1cf9c795e
company,1776939300,"Visa, Mastercard face new suit over card fees",139864194,https://s.yimg.com/rz/stage/p/yahoo_finance_en-US_h_p_finance_2.png,MA,Yahoo,Three plaintiffs say a 2019 settlement in card fee litigation should not give the card networks years of legal immunity for antitrust claims.,https://finnhub.io/api/news?id=086220433cbaeb35db032b35743153d6ad2c8c08775fb886e077d9380a28c1de
