category,datetime,headline,id,image,related,source,summary,url
company,1776972480,How Stodgy Texas Instruments Became a Hot AI Chip Stock,139869501,https://s.yimg.com/rz/stage/p/yahoo_finance_en-US_h_p_finance_2.png,NXPI,Yahoo,An upbeat outlook from Texas Instruments boosts investors’ confidence in a handful of semiconductor stocks.,https://finnhub.io/api/news?id=925fa0df19b9f0f2c4931edc5e7c5c35822d0c8ccc3c59433b37f2795b50de47
company,1776965040,On Semi and Analog Devices Stocks Head for Record Highs. Thank Texas Instruments.,139867853,https://s.yimg.com/rz/stage/p/yahoo_finance_en-US_h_p_finance_2.png,NXPI,Yahoo,An upbeat outlook from Texas Instruments boosts investors’ confidence in a handful of semiconductor stocks.,https://finnhub.io/api/news?id=dece95795879af0d36b9d6d80661a67b25acb5a76e7c42a431d106bddcc23dd7
company,1776962104,What's going on in today's session: S&P500 movers,139865123,https://www.chartmill.com/images/uploads/CM_Top_Movers_Small_free_2b4ff2fc22.webp,NXPI,ChartMill,Curious about the S&P500 stocks that are in motion on Thursday? Join us as we explore the top movers within the S&P500 index during today's session.,https://finnhub.io/api/news?id=045c7b48b65007e164a85ff803fd33eecc2fc353fcd25256a546df5c8edcf0d2
company,1776954905,Thursday's session: gap up and gap down stock in the S&P500 index,139863460,https://www.chartmill.com/images/uploads/CM_Gap_Stocks_Small_free_ad767b11cf.webp,NXPI,ChartMill,Let's have a look at what is happening on the US markets on Thursday. Below you can find the S&P500 gap up and gap down stocks in today's session.,https://finnhub.io/api/news?id=3e77378a8303755471e1b6024163e0b35e5a58eb2c00b94f05f77d23bb01eea5
company,1776952817,Monolithic Power (MPWR) Earnings Expected to Grow: What to Know Ahead of Next Week's Release,139864451,https://s.yimg.com/rz/stage/p/yahoo_finance_en-US_h_p_finance_2.png,NXPI,Yahoo,Monolithic (MPWR) possesses the right combination of the two key ingredients for a likely earnings beat in its upcoming report. Get prepared with the key expectations.,https://finnhub.io/api/news?id=c2d32d41b3c7ba8b51aa15902eef1d3af451341e8bd4ff5dee8dcc4fdc0bbfc3
