category,datetime,headline,id,image,related,source,summary,url
company,1776980760,S&P Dow Jones Indices Announces Dow Jones Best-in-Class Indices 2026 Review Results,139869527,https://s.yimg.com/rz/stage/p/yahoo_finance_en-US_h_p_finance_2.png,SPGI,Yahoo,"S&P Dow Jones Indices (""S&P DJI""), the world's leading index provider, today announced the results of the annual Dow Jones Best-in-Class Indices (DJ BIC) rebalancing and reconstitution. The DJ BIC are float-adjusted market capitalization weighted indices that track equity markets while applying a sustainability best-in-class selection process.",https://finnhub.io/api/news?id=d82e58d83971c07a7114a9963852ee793f7533378745ff23a3f14ead28f31d96
company,1776965400,ARGAN SUCCESSFULLY PLACED AN INAUGURAL €500M GREEN BOND,139866377,https://s.yimg.com/rz/stage/p/yahoo_finance_en-US_h_p_finance_2.png,SPGI,Yahoo,"Press release – Neuilly-sur-Seine, Thursday, April 23, 2026 – 7.30pm ARGAN successfully placed an inaugural €500m green bond ARGAN today announced it successfully placed an inaugural 500 million euros green bond, maturing in October 2029, with an annual coupon of 3.779% (i.e., a margin of MS + 100 bps) in line with the company’s expectations1, as outlined in particular in its 2025 annual results2. This first green bond—5.5 times oversubscribed—demonstrates investors’ confidence in ARGAN’s strate",https://finnhub.io/api/news?id=9954f0f26387e97827b9dcf23e58f70293cf4fc47c8e85e7a15e80fabcfc9c07
company,1776954360,S&P Global Gears Up to Report Q1 Earnings: What's in the Offing?,139864347,https://s.yimg.com/rz/stage/p/yahoo_finance_en-US_h_p_finance_2.png,SPGI,Yahoo,"SPGI eyes Q1 results with revenues seen rising 7.6% and EPS up 4.8%, driven by strength across ratings, indices and market intelligence segments.",https://finnhub.io/api/news?id=6a8bec16a9320ddae9bdda4c08f3148f2836be3d8b9864ed7dd8b86afa46bb8c
company,1776952804,IntercontinentalExchange (ICE) Earnings Expected to Grow: What to Know Ahead of Next Week's Release,139864348,https://s.yimg.com/rz/stage/p/yahoo_finance_en-US_h_p_finance_2.png,SPGI,Yahoo,ICE (ICE) possesses the right combination of the two key ingredients for a likely earnings beat in its upcoming report. Get prepared with the key expectations.,https://finnhub.io/api/news?id=d6223eab87a40df8189beec86d87fd56a32e8da133f498c0251ccd0e33adff18
company,1776951421,Here’s S&P Global’s (SPGI) Valuation Analysis,139862820,https://s.yimg.com/rz/stage/p/yahoo_finance_en-US_h_p_finance_2.png,SPGI,Yahoo,"Montaka Global Investments, an investment management company, released its first-quarter 2026 investor letter. A copy of the letter is available to download here. The March quarter was dominated by Iran’s geopolitical conflict, which sharply revised stocks’ valuation multiples. In Q1, the portfolio holdings declined due to valuation changes, but the firm trusts in the stocks’ […]",https://finnhub.io/api/news?id=72eed90882646e3ea766366342edea60e4cafed51be215a247f2ae446a62a22e
company,1776950615,S&P Global ($SPGI) Benefits from Its Strong Growth Prospects and Defensive Stability,139862821,https://s.yimg.com/rz/stage/p/yahoo_finance_en-US_h_p_finance_2.png,SPGI,Yahoo,"White Brook Capital Partners, an investment management firm, released its first-quarter 2026 investor letter. A copy of the letter can be downloaded here. The letter indicated that the first quarter of 2026 was a turnaround period. During this quarter, US military actions against Iran and developments in AI dominated economic discussions. These military interventions created a […]",https://finnhub.io/api/news?id=cbe4e015e0de5edc583272d7bb3e423b3cfbb13ef8c7b3fce145fca59cd4b968
company,1776950286,"Committee stocks on the move: United Rentals, Thermo Fisher, CBRE and American Express",139865654,https://image.cnbcfm.com/api/v1/image/108296338-17769621651776962162-45460792378-1080pnbcnews.jpg?v=1776962164&w=1920&h=1080,SPGI,CNBC,The Investment Committee react to some of their stocks that are moving today and reveal their strategies for each name.,https://finnhub.io/api/news?id=712ad2c21c1bd1410385b21c852302d156c645ae54d9c76e192fe6d698e7e6a7
company,1776950102,S&P Global (SPGI) Q1 Earnings Preview: What You Should Know Beyond the Headline Estimates,139864349,https://s.yimg.com/rz/stage/p/yahoo_finance_en-US_h_p_finance_2.png,SPGI,Yahoo,"Besides Wall Street's top-and-bottom-line estimates for S&P Global (SPGI), review projections for some of its key metrics to gain a deeper understanding of how the company might have fared during the quarter ended March 2026.",https://finnhub.io/api/news?id=ae81420206210f0486932ac42323507c990cfd5abf91793925f4bb30c0ecb9db
company,1776943892,Stocks Fall Pre-Bell as US-Iran Peace Talks Stall; Traders Parse Tesla's Results,139861121,https://s.yimg.com/rz/stage/p/yahoo_finance_en-US_h_p_finance_2.png,SPGI,Yahoo,"US equity futures were tracking in the red on Thursday, with no apparent signs of progress in peace",https://finnhub.io/api/news?id=f8960bc9f074e846946ab4121736c1ec413db12818fa3cb85affafbba52903bb
company,1776939989,U.S. Business Activity Expands in April,139863203,,SPGI,Finnhub,"By Jessica Coacci U.S. business activity in the private sector expanded in April having slowed to near-stagnation in March following the outbreak of the war in the Middle East, a monthly survey...",https://finnhub.io/api/news?id=ef9382b8c07bceed0d83994e80a8b2c8f56346b51fc8e07a2cf9f68b4928568f
company,1776936919,Canada Factory Sales Estimated Up 3.5% in March,139862425,,SPGI,Finnhub,"By Robb M. Stewart OTTAWA--Factory activity in Canada continued to see solid growth last month, with an early estimate pointing a further rise in sales driven by the petroleum sector where energy...",https://finnhub.io/api/news?id=57ba4b23746ad7133a5a04fce45de1a3c3b19ae70a35f31eb302e5d2d0a73fa9
company,1776936651,Stocks are at record highs and shrugging off the war with Iran,139861251,https://s.yimg.com/rz/stage/p/yahoo_finance_en-US_h_p_finance_2.png,SPGI,Yahoo,Brent crude has climbed back above $100 per barrel and the Strait of Hormuz remains closed. But the stock market is brushing off the turmoil.,https://finnhub.io/api/news?id=55feb421f640f36fd513a5a7f0421e8db6f4bf5fbb1256876f53c55567a084fe
company,1776929804,Euro zone bond yields up as Hormuz risks outweigh weak PMI data,139860911,,SPGI,Finnhub,"The euro zone's short-datedgovernment bond yields ticked lower on the heels of weakeconomic data, but remained on track for their fourth daily riseas tensions around the Strait of Hormuz bolstered...",https://finnhub.io/api/news?id=6428cfd34e06a093b6f19e52baa9811ce3fd69b38634a807162826b7db785944
company,1776921440,"UK economy rebounds in April, but cost pressures cloud outlook",139859629,,SPGI,Finnhub,"The UK private sector regained growth momentum in April, according to preliminary purchasing managers' index survey results released by S&P Global on Thursday. The flash PMI composite output index...",https://finnhub.io/api/news?id=0126479f84d6afd09aae476e16907c0d3c1e4180804c07331dfebb6b1112d514
company,1776920020,How the Iran war has stoked competition between India and China for Russian oil,139865755,https://image.cnbcfm.com/api/v1/image/108192828-1756730177551-gettyimages-2232556977-CHINA_SOC_SUMMIT.jpeg?v=1756775496&w=1920&h=1080,SPGI,CNBC,"As the Iran war drags on and the Strait of Hormuz stays shut, India and China are increasingly competing against each other for shrinking crude oil supplies.",https://finnhub.io/api/news?id=a0ad76755f389eadf6c2d5671c9d49d274beed57518cb2ebd9db910522d20405
company,1776918952,"UK companies see cost pressures spreading at record pace, PMI shows",139859395,,SPGI,Finnhub,"The share of British companies reporting rising costs surged by a record amount this month, a clear warning of higher inflation ahead as fallout from the Iran war spreads through the economy, a survey...",https://finnhub.io/api/news?id=88e0c06a89367087ec418b7ce6d4a72a409be4ed2b1e78dce4ab2700d378ca14
company,1776917049,"Euro zone business activity contracted in April as costs rocketed, PMI shows",139859151,,SPGI,Finnhub,"Business activity in the euro zone suffered a surprise contraction in April with the U.S.-Israeli war with Iran sapping demand as prices soared, a closely watched survey showed on Thursday. ...",https://finnhub.io/api/news?id=66bdc57eb0eabf7b9822b75064407d53057b98679ab15abc25cb65926cc341f3
company,1776916928,Philippine central bank hikes policy rate by 25 basis points,139859149,,SPGI,Finnhub,"The Philippine central bankhiked its key interest rate to 4.50% on Thursday to keep a lidon inflation, driven by rising fuel costs caused by disruptionsin the Middle East. In an April...",https://finnhub.io/api/news?id=0ca07ad40a4e79309e1ddee09fe76e617823c238d5b36f01865bded2fecb89a6
company,1776915471,"German private sector contracts for first time in nearly a year, PMI shows",139858889,,SPGI,Finnhub,"Germany's private sector contracted for the first time in almost a year in April as the Iran war put the brakes on the country's economic recovery, hitting demand and driving up prices, a survey...",https://finnhub.io/api/news?id=d7cd2d352e36e41301c133ffac61c073b321bef40f7774f7617f586b69912c75
company,1776914806,"French economic activity contracted at fastest pace in 14 months, survey shows",139858798,,SPGI,Finnhub,"Business activity in France's private sector contracted at its fastest pace in 14 months as a downturn in the services sector amid the Iran war outweighed stronger factory output growth, a preliminary...",https://finnhub.io/api/news?id=64eed1c0fe8270421398d033e9ad09522030c090b00b8679f60649c9cb1878bb
company,1776910602,Asia-Pacific Flash PMIs Show Strains Emerging From Mideast War,139858442,,SPGI,Finnhub,"By Fabiana Negrin Ochoa and James Glynn Gauges of manufacturing and services activity in Asia-Pacific showed that the Middle East war is starting to take a heavier toll on industries, despite...",https://finnhub.io/api/news?id=b6bd04e77026d59a75fd5648ff4d8528c859e087f13c2b2544d2bb5d3033c764
company,1776908992,"Factory rebound lifts India's private sector growth in April, PMI shows",139858113,,SPGI,Finnhub,"Growth in India's private sector accelerated in April as manufacturing and services activity rebounded after cooling last month despite elevated price pressures, a survey showed. The...",https://finnhub.io/api/news?id=6a990743dae267afe3107f4aefa743498985c41fa81cdaa60bd9224fa30081bb
