category,datetime,headline,id,image,related,source,summary,url
company,1776983580,Walmart and Target face new self-checkout retail theft problems,139870511,https://s.yimg.com/rz/stage/p/yahoo_finance_en-US_h_p_finance_2.png,TGT,Yahoo,"Self-checkout takes work once done by retail employees and makes consumers do it. That's something many retail chains try to sell as a positive, rather than a spending cut. ""Self-checkout technology is typically positioned by retailers as a consumer service at the front end of stores that enables ...",https://finnhub.io/api/news?id=3a439f3c2c4d6079da093f150fc8017bb1e9336038752ab8a5a833e1cb33f2e1
company,1776973620,Target helps fill gap left by shuttered competitor,139867767,https://s.yimg.com/rz/stage/p/yahoo_finance_en-US_h_p_finance_2.png,TGT,Yahoo,"For years, Target had a certain reputation. It was a store you could walk into expecting a fun, engaging shopping experience. To be clear, Target wasn't really known as a source of major savings. Walmart, one of its chief competitors, has long dominated in that arena. Target's strength, rather, was ...",https://finnhub.io/api/news?id=6051251aa32cf0c97e8718e9153f5732d36f368c823159df14dbbf075f5be328
company,1776966559,What to Expect From Target Corporation's Next Quarterly Earnings Report,139870649,https://s.yimg.com/rz/stage/p/yahoo_finance_en-US_h_p_finance_2.png,TGT,Yahoo,"Target Corporation is expected to release its fiscal first-quarter earnings soon, and analysts project a single-digit profit rise.",https://finnhub.io/api/news?id=b7d7a7cd941a60b2c529280b15eb6fb56cfa59b5c6935c7c7f7cc6bf5ce3d581
company,1776956520,Conagra Stock Is Down 17% This Year. Two Insiders Snapped Up Shares Anyway.,139866478,https://s.yimg.com/rz/stage/p/yahoo_finance_en-US_h_p_finance_2.png,TGT,Yahoo,"Shares of frozen food company  Conagra Brands  have underperformed the market, hampered by falling volumes and margin pressure.  Two company insiders took the opportunity to increase their holdings.  A Form 4 filed with the Securities and Exchange Commission shows John Mulligan, a company director and former  Target  executive, snapped up 17,500 shares for $14.31 each on April 14.",https://finnhub.io/api/news?id=1f83e561c111d45b6a32450ac76afbec79993fbd4917fe24f354a0242de1ee48
company,1776956400,Ecommerce Founders Who Ignore This Type of AI Will Lose Their Best Customers — Here’s Why,139868197,https://s.yimg.com/rz/stage/p/yahoo_finance_en-US_h_p_finance_2.png,TGT,Yahoo,"That whole messy, human-driven journey to buy something? AI is starting to do it for us.",https://finnhub.io/api/news?id=052b300b11727db34fc15622d96078111aaf1e8ee4a0d9458baba3a4e205791d
company,1776951918,"Best Buy, America’s Worst Retailer, Gets A New CEO",139862558,https://s.yimg.com/rz/stage/p/yahoo_finance_en-US_h_p_finance_2.png,TGT,Yahoo,"Best Buy (NYSE: BBY) announced that Jason Bonfig, the company’s Chief Customer, Product, and Fulfillment Officer, would succeed Corie Barry as the next Chief Executive Officer at Best Buy. Berry became Best Buy’s CEO in 2019. She has done a great deal to weaken the company. Its stock is down 46% over the last five ... Best Buy, America’s Worst Retailer, Gets A New CEO",https://finnhub.io/api/news?id=57e71a915c8a36b0b2ead5759924ed741df66e8cea997e5f33d8f54f74b28f41
company,1776935319,Fixed-rate mortgages: What you need to know and the best lender options,139865532,https://image.cnbcfm.com/api/v1/image/108295560-1776878976252-gettyimages-2206216829-house28.jpeg?v=1776879000&w=1920&h=1080,TGT,CNBC,Here's what you need to know about the most common type of mortgage rate.,https://finnhub.io/api/news?id=68282240db2ced1487b83a8dbdc1623e1e9e642803ac05ea1e9563c42bc6dad3
company,1776933796,Jeni’s Splendid Ice Creams scoops up Ben & Jerry’s CEO,139862914,https://s.yimg.com/rz/stage/p/yahoo_finance_en-US_h_p_finance_2.png,TGT,Yahoo,"David Stever, who spent decades at the Vermont-based creamery, joins Jeni’s as it prepares for a new era of national expansion.",https://finnhub.io/api/news?id=b7b633a058d1d77c95830a83ab731fcc82aa4acce2f0e5f536f6b7b97089b3b4
