category,datetime,headline,id,image,related,source,summary,url
company,1776987683,2 Healthcare Stocks Worth Your Attention and 1 We Ignore,139870521,https://s.yimg.com/rz/stage/p/yahoo_finance_en-US_h_p_finance_2.png,UNH,Yahoo,"Healthcare companies are pushing the status quo by innovating in areas like drug development and digital health. But financial performance has lagged recently as players offloaded surplus COVID inventories in 2023 and 2024, a headwind for overall demand. The result? Over the past six months, the industry’s 1.8% return has trailed the S&P 500 by 3.1 percentage points.",https://finnhub.io/api/news?id=4469439b2a712e19fef672f808861f6061d701365bbdfd3dd67b365bb9c8aa37
company,1776982980,These Companies Are Raising Guidance This Earnings Season,139871315,https://s.yimg.com/rz/stage/p/yahoo_finance_en-US_h_p_finance_2.png,UNH,Yahoo,"Both UnitedHealth and Quest Diagnostics have raised their current year outlooks, with each also seeing a favorable post-earnings reaction.",https://finnhub.io/api/news?id=2c8457f8a5a3e6114626efacd3374cbafdb922222ed6812a1dc8a86b43eb4aaf
company,1776976440,"Top Research Reports for UnitedHealth, Morgan Stanley & RTX",139870522,https://s.yimg.com/rz/stage/p/yahoo_finance_en-US_h_p_finance_2.png,UNH,Yahoo,"UnitedHealth anchors a fresh batch of Zacks reports as UNH, MS and RTX navigate costs, capital markets strength and defense demand shifts.",https://finnhub.io/api/news?id=01fa23a96e09b8ac2fc51ded659406739bd42772d1538950cc32550fb607e959
company,1776973776,Pool Q1 Earnings Call Highlights,139868085,https://s.yimg.com/rz/stage/p/yahoo_finance_en-US_h_p_finance_2.png,UNH,Yahoo,"Pool (NASDAQ:POOL) reported a stronger-than-expected start to fiscal 2026, driven by steady maintenance demand, improving trends in select discretionary categories, and continued growth in its digital and proprietary product initiatives. Management said the pool industry remains in a “period of stab",https://finnhub.io/api/news?id=9206c1053987c9c61267e3baa536a8547476f2998d77fb36fc5112b1b74502c7
company,1776972250,"We know parts of the market are hot, says Jim Cramer",139878618,https://image.cnbcfm.com/api/v1/image/108296592-5ED3-MM-A-BLOCK-042326.jpg?v=1776984173&w=1920&h=1080,UNH,CNBC,'Mad Money' host Jim Cramer looks at the day's market action.,https://finnhub.io/api/news?id=8e819e7f751abaa2bc519358b10fb5be0ac0aff06f568c4ea5142acd30852fa3
company,1776972209,Jim Cramer looks at four stocks to go with high-flying tech names,139878643,https://image.cnbcfm.com/api/v1/image/108296593-5ED3-MM-A-BLOCK-SHORT-042326.jpg?v=1776984189&w=1920&h=1080,UNH,CNBC,'Mad Money' host Jim Cramer looks at the day's market action.,https://finnhub.io/api/news?id=41270dfe5cfe73c066157f534389be98233b1dcd0d950c4b69f40e285ad3719d
company,1776970560,"MOH Q1 EPS Tops Estimates on Lower Medical Costs, Membership Declines",139867935,https://s.yimg.com/rz/stage/p/yahoo_finance_en-US_h_p_finance_2.png,UNH,Yahoo,"Molina Healthcare beats Q1 EPS estimates, but profits plunge 61% as revenues dip, membership shrinks and premiums decline despite lower medical costs support.",https://finnhub.io/api/news?id=63710636226215529e21b714a152b7f2197cb84343f835806fdbad73fe372c66
company,1776962704,US accelerates Medicare access for select medical devices,139868545,,UNH,Finnhub,US health authorities have announced a new program aimed at significantly reducing the time required for certain medical devices to secure Medicare reimbursement. Coverage could now be granted within...,https://finnhub.io/api/news?id=1f25fc6e6c091d79ec584539d7cbf2ed1a5b5c2124910b203c35367b45cee03a
company,1776961927,UnitedHealth Is Back! But Should You 'Long-Term Care' About UNH Stock?,139870523,https://s.yimg.com/rz/stage/p/yahoo_finance_en-US_h_p_finance_2.png,UNH,Yahoo,"UnitedHealth reported Q1 earnings earlier this week, and it's a comeback story worth watching. Here's what to know.",https://finnhub.io/api/news?id=9386d626432b245737508dd5e1800d372147f2d7787f6fbfb872550d2f289dd1
company,1776959651,Why BSX Stock's Q1 Beat Is A Lagging Indicator,139866256,https://s.yimg.com/rz/stage/p/yahoo_finance_en-US_h_p_finance_2.png,UNH,Yahoo,"The primary insight within Boston Scientific’s (BSX) Q1 2026 results is that the adjusted EPS beat of $0.80 acts as a lagging indicator, contrasting with a moderating trend in forward-looking growth. While management maintained a 28.0% operating margin, the decision to revise full-year 2026 organic revenue guidance from a 10%–11% range to 6.5%–8.0% is the critical signal for investors. This dynamic highlights a strategic divergence from other healthcare leaders. For instance, while our analysis",https://finnhub.io/api/news?id=0918df89b280d5d627ab5492395fcc973d12eab45216cf30599e68d6953fd7d4
company,1776954602,UnitedHealth Just Raised Its Full-Year Guidance. Is the Long-Anticipated Turnaround in UNH Stock Finally Here?,139869446,https://s.yimg.com/rz/stage/p/yahoo_finance_en-US_h_p_finance_2.png,UNH,Yahoo,"UnitedHealth’s blowout Q1 marks the first clear, numbers‑backed step toward a real turnaround after last year’s credibility hit.",https://finnhub.io/api/news?id=9a5b7f375176ebdc129b1b47c0bac0749376b8ea30ca2f28af155c1190d75cc8
company,1776953169,Jim Cramer Says UnitedHealth Group Is a Buy. History Suggests He’s Right,139864230,https://s.yimg.com/rz/stage/p/yahoo_finance_en-US_h_p_finance_2.png,UNH,Yahoo,"On his April 21 episode of Mad Money, Jim Cramer held up UnitedHealth Group (NYSE:UNH) as a textbook example of why investors should trade on fundamentals rather than fear. The stock cratered through 2025, the market wrote it off, and now the turnaround is materializing in the numbers. Cramer pointed specifically to the return of ... Jim Cramer Says UnitedHealth Group Is a Buy. History Suggests He’s Right",https://finnhub.io/api/news?id=d16b26756d73d8d74d78c34af8aa3e0e8847108b016b6347667dc54e5bfdf7b3
company,1776950127,Risky meme trading is back. A trading rule change may have lit the fuse,139865391,https://image.cnbcfm.com/api/v1/image/108294016-1776698311805-gettyimages-2271683421-AFP_A8ED8QH.jpeg?v=1776949286&w=1920&h=1080,UNH,CNBC,A regulatory shift is expected to remove barriers to rapid-fire trading and help revive a meme-stock frenzy.,https://finnhub.io/api/news?id=a79252f9c5d6f21f4e38ab3b46f1b73f268c1b59e3c283eccfa4886a1529abf6
company,1776949156,"TD Cowen Maintains Hold on UnitedHealth Group, Raises Price Target to $337",139869702,,UNH,Benzinga,TD Cowen  analyst Ryan Langston   maintains UnitedHealth Group (NYSE:UNH) with a Hold and raises the price target from $311 to $337.,https://finnhub.io/api/news?id=f6dc3ba2fc55e7b6700b70e89e2d03978aa84031a45bc8725f25ef0379684487
company,1776946919,What Makes UnitedHealth Group (UNH) the Best in Value-Based Care Service?,139862733,https://s.yimg.com/rz/stage/p/yahoo_finance_en-US_h_p_finance_2.png,UNH,Yahoo,"Investment management company Vulcan Value Partners recently released its first-quarter 2026 investor letter. A copy of the letter can be downloaded here. The firm focuses on improving long-term returns and lowering risk, rather than short-term results. In the quarter, the Large Cap Composite (Net) returned -14.1%, the Small Cap Composite (Net) returned -6.8%, the Focus Composite (Net) returned […]",https://finnhub.io/api/news?id=9bf18035b5177919db4ce996d3ddf150e795b03d83d0d4c06bef71c48672084a
company,1776945832,Molina controls costs in Q1 but future Medicaid spending in doubt,139866289,https://s.yimg.com/rz/stage/p/yahoo_finance_en-US_h_p_finance_2.png,UNH,Yahoo,The insurer beat analyst expectations for adjusted earnings in the first quarter. But steeper Medicaid membership losses than expected could saddle Molina with higher costs down the line.,https://finnhub.io/api/news?id=503c7d564487427488078e5203b8ac4984d49d2759a1bd8691d651a705c7a175
company,1776935040,UnitedHealth Just Proved Warren Buffett Right -- Again,139859891,https://s.yimg.com/rz/stage/p/yahoo_finance_en-US_h_p_finance_2.png,UNH,Yahoo,"Investors are seeing why Buffett earned the nickname ""the Oracle of Omaha.""",https://finnhub.io/api/news?id=92d05192daa36b732f2950654e38df82978bf5f00f968988fac398f1afe1ebe0
company,1776934011,Jim Cramer's top 10 things to watch in the stock market Thursday,139865510,https://image.cnbcfm.com/api/v1/image/108243236-1766004042541-gettyimages-2251789258-TI_WAFER_PLANT.jpeg?v=1766004250&w=1920&h=1080,UNH,CNBC,Texas Instruments is the star of the earnings show.,https://finnhub.io/api/news?id=24d31d9d8596ac46e7dfb5f409912c41267708a9dc7875eed453eeeb95b3c3d8
company,1776933645,UnitedHealth Group Incorporated (UNH) Launches Broad Rural Health Initiative to Strengthen Underserved Communities,139859955,https://s.yimg.com/rz/stage/p/yahoo_finance_en-US_h_p_finance_2.png,UNH,Yahoo,"We recently compiled a list of the 10 Most Undervalued Dow Stocks to Buy Now. UnitedHealth Group Incorporated is among the most undervalued stocks. TheFly reported on April 7 that HSBC upgraded UnitedHealth Group Incorporated (NYSE:UNH) from Reduce to Hold and set a price target of $300. More recently, on April 20, UNH announced a […]",https://finnhub.io/api/news?id=72a4b693dffbd9077b3e244bf3396ac532e7b7849643d96e35d563e2655a4e4d
company,1776920670,Independent Chair Proposal Tests Governance And Valuation Views At UnitedHealth Group,139858186,https://s.yimg.com/rz/stage/p/yahoo_finance_en-US_h_p_finance_2.png,UNH,Yahoo,"A shareholder proposal asks that any future Board Chair at UnitedHealth Group (NYSE:UNH) be an independent director. The proposal will be put to a vote at the company’s upcoming annual meeting. UnitedHealth Group’s board is opposing the measure and is encouraging shareholders to vote against it. The filing highlights investor interest in board independence and oversight at large health insurers. UnitedHealth Group, traded as NYSE:UNH, is one of the largest health insurers globally, with...",https://finnhub.io/api/news?id=d88c58989ff03b76eb51eff3f7fba9b35f4476d1e6b72e6aa5d146361f9c9b87
company,1776902687,Argus Research Upgrades UnitedHealth Group (UNH),139856284,,UNH,Fintel,,https://finnhub.io/api/news?id=0e8811859315f8c25bef28585140ed1f30a2643fe14186e7dbab33dc6bd6a636
