category,datetime,headline,id,image,related,source,summary,url
company,1776985515,A Look At Xylem (XYL) Valuation As Earnings Expectations And Water Reuse Growth Attract Investor Interest,139870673,https://s.yimg.com/rz/stage/p/yahoo_finance_en-US_h_p_finance_2.png,XYL,Yahoo,"Recent expectations for higher earnings and revenues have put Xylem (XYL) in focus, as investors weigh upbeat sentiment against its role in the expanding global water reuse and treatment markets, where the company is already a key player. See our latest analysis for Xylem. Despite upbeat expectations around the upcoming earnings report, Xylem’s recent trading tells a more mixed story, with a 90 day share price return of -13.84% and a 1 year total shareholder return of 6.55% suggesting longer...",https://finnhub.io/api/news?id=bf26f36269a98ada57beb84171de0a05e317478739b0931520804ceef97948b5
company,1776962460,Veralto Gears Up to Report Q1 Earnings: What's in the Cards?,139866556,https://s.yimg.com/rz/stage/p/yahoo_finance_en-US_h_p_finance_2.png,XYL,Yahoo,"VLTO's Q1 revenues and earnings are expected to grow, backed by strong water quality demand and recent acquisitions.",https://finnhub.io/api/news?id=bb6402e9b020981c47eda27708354bcab20a75e9e45f60df3e4c77dc28ed2136
company,1776961800,"Global Water and Wastewater Treatment Market Size/Share Worth USD 584.63 Billion by 2035 at a 5.8% CAGR: Custom Market Insights (Analysis, Outlook, Leaders, Report, Trends, Forecast, Segmentation, Growth Rate, Value, SWOT Analysis)",139866557,https://s.yimg.com/rz/stage/p/yahoo_finance_en-US_h_p_finance_2.png,XYL,Yahoo,"[220+ Pages Latest Report] According to a market research study published by Custom Market Insights, the demand analysis of Global Water and Wastewater Treatment Market size & share revenue was valued at approximately USD 312.47 Billion in 2025 and is expected to reach USD 332.84 Billion in 2026 and is expected to reach around USD 584.63 Billion by 2035, at a CAGR of 5.8% between 2026 and 2035. The key market players listed in the report with their sales, revenues and strategies are Veolia Envir",https://finnhub.io/api/news?id=7785c6d9a58373b061d3a24f562b6fe410f8d5d8571bfe0f55043e6af09817e0
company,1776958560,Xylem Gears Up to Report Q1 Earnings: What's in the Offing?,139866261,https://s.yimg.com/rz/stage/p/yahoo_finance_en-US_h_p_finance_2.png,XYL,Yahoo,"XYL heads into Q1 results with modest revenue and EPS growth expected, backed by infrastructure demand and acquisitions despite cost pressures.",https://finnhub.io/api/news?id=bb06935e4517760a268e38924b49661a5ee9ace408d80d9943f3b9cbbecff4e4
company,1776952811,Casella (CWST) Expected to Beat Earnings Estimates: What to Know Ahead of Q1 Release,139864575,https://s.yimg.com/rz/stage/p/yahoo_finance_en-US_h_p_finance_2.png,XYL,Yahoo,Casella (CWST) possesses the right combination of the two key ingredients for a likely earnings beat in its upcoming report. Get prepared with the key expectations.,https://finnhub.io/api/news?id=7a144f09528ca5d5a97e18c81b1f0e1432403ca761389638f7884bb8bdd76359
company,1776935400,2025 Membrane and Filtration Market Research Review Report,139860076,https://s.yimg.com/rz/stage/p/yahoo_finance_en-US_h_p_finance_2.png,XYL,Yahoo,"Main market opportunities lie in sustainable water management, advanced membrane bioreactors, and technological integration with AI and IoT. Rising demand for cleaner water and regulatory compliance drives growth, with leaders like Veolia and Xylem pioneering smart solutions in a capital-intensive landscape.Dublin, April 23, 2026 (GLOBE NEWSWIRE) -- The ""2025 Membrane and Filtration Research Review"" report has been added to ResearchAndMarkets.com's offering.Key Market Valuations: The global mark",https://finnhub.io/api/news?id=2090e53c0b36968c75563aee9035b9e1bdb6d77a67a96c659c2d5ee2e7d144f5
